00102;MINISTERIO DE INDUSTRIAS;;CARRETERA TOLEDO NO. 18449 ENTRE AVE. 184 Y AUTOPISTA NO. 3, RPTO. CAPDEVILA;15/01/2013;2313;7513;0;102;999;2;UP;05;0;00102
00104;MINISTERIO DE ENERGIA Y MINAS;;AVE. SALVADOR ALLENDE NO. 666 E/ OQUENDO Y SOLEDAD;26/12/2012;2303;7513;0;104;999;2;UP;05;0;00104
00111;MINISTERIO DE LA INDUSTRIA ALIMENTARIA;;AVE. 41 NO. 4455 E/ 48 Y 50;04/05/2009;2301;7513;0;111;999;2;UP;05;0;00111
00113;INSTITUTO NACIONAL DE RECURSOS HIDRAULICOS;;CALLE HUMBOLDT NO. 106, E/ P E INFANTA, VEDADO;31/07/1989;2302;7513;0;113;013;2;UP;05;0;00113
00126;MINISTERIO DE LA CONSTRUCCION;;AVENIDA CARLOS MANUEL DE CESPEDES Y 35, VEDADO;31/01/1977;2302;7513;0;126;999;2;UP;05;0;
00131;MINISTERIO DE LA AGRICULTURA;;CONILL Y AVE. INDEPENDENCIA;31/01/1977;2302;7513;0;131;999;2;UP;05;0;
00151;MINISTERIO DEL TRANSPORTE;;AVE CARLOS M. DE CESPEDES ESQ TULIPAN;31/01/1977;2302;7513;0;151;999;2;UP;05;0;00151
00153;INSTITUTO NACIONAL DE RESERVAS ESTATALES;;CALLE 44, NO. 314, E/ 3RA Y 5TA AVE.;30/09/2005;2301;7513;0;271;999;2;UP;05;0;00271
00161;MINISTERIO DE COMUNICACIONES;;AVE. INDEPENDENCIA E/ ARANGUREN Y 19 DE MAYO;31/01/1977;2302;7513;0;161;999;2;UP;05;0;00161
00171;MINISTERIO DEL COMERCIO INTERIOR;;HABANA NO. 258 E/ EMPEDRADO Y SAN DE DIOS;31/01/1977;2304;7513;0;171;999;2;UP;05;0;
00174;MINISTERIO DEL COMERCIO EXTERIOR Y LA INVERSION EXTRANJERA;;INFANTA NO. 16 E/ 23 Y HUMBOLDT;07/05/2009;2302;7513;0;174;999;2;UP;05;0;
00211;MINISTERIO DE CIENCIA, TECNOLOGIA Y MEDIO AMBIENTE;;CALLE M, NO. 260 ENTRE 21 Y 19, VEDADO;31/01/1977;2302;7513;0;211;999;2;UP;05;0;
00221;MINISTERIO DE EDUCACION;;CALLE 17 Y O, VEDADO;31/01/1977;2302;7512;0;221;999;2;UP;05;0;00221
00223;MINISTERIO DE EDUCACION SUPERIOR;;23 NO.565 ESQUINA A F. VEDADO;31/01/1977;2302;7512;0;223;999;2;UP;05;0;00223
00233;INSTITUTO CUBANO DE RADIO Y TELEVISION;;CALLE 23 NO. 258 E/ L Y M. VEDADO;30/04/1983;2302;7512;0;233;999;2;UP;05;0;
00234;MINISTERIO DE CULTURA;;;31/01/1977;2302;7512;0;234;999;2;UP;05;0;00234
00241;MINISTERIO DE SALUD PUBLICA;;CALLE 23 NO. 201 ESQ. N, VEDADO;31/01/1977;2302;7512;0;241;999;2;UP;05;0;00241
00242;INSTITUTO NACIONAL DE DEPORTES, EDUCACION FISICA Y RECREACION;;VIA BLANCA Y RANCHO BOYEROS;31/01/1977;2310;7512;0;242;999;2;UP;05;0;00242
00249;CONTRALORIA GENERAL DE LA REPUBLICA;;Calle 23 No. 801 esquina a B.;22/01/2010;2302;7511;0;249;999;2;UP;05;0;00249
00251;BANCO NACIONAL DE CUBA;BNC;AGUIAR NO. 456 ENTRE LAMPARILLA Y AMARGURA;31/05/1983;2304;6519;0;251;999;1;BANC;04;0;
00253;BANCO POPULAR DE AHORRO;BPA;CALLE 16 NO. 306 ENTRE 3RA AVE. Y 5TA AVE.;31/05/1983;2301;6519;0;253;999;1;BANC;04;0;
00254;MINISTERIO DE FINANZAS Y PRECIOS;;CALLE OBISPO NO. 211, ESQ. A CUBA;30/06/1994;2304;7511;0;254;999;2;UP;05;0;
00256;MINISTERIO DE TURISMO;;AVENIDA MALECON Y G, VEDADO;30/06/1994;2302;7513;0;256;999;2;UP;05;0;00256
00257;BANCO CENTRAL DE CUBA;BANCO CENTRAL;CALLE CUBA # 402 ENTRE LAMPARILLA Y AMARGURA;31/10/1997;2304;6511;0;257;999;1;BANC;04;0;
00258;BANCO DE CREDITO Y COMERCIO;BANDEC;AMARGURA NO. 158 E/ AGUIAR Y CUBA;31/12/1997;2304;6519;0;258;999;1;BANC;04;0;
00259;BANCO EXTERIOR DE CUBA;;23 ESQUINA P;29/02/2000;2302;6519;1;259;999;1;BANC;04;0;00259
00261;MINISTERIO DE ECONOMIA Y PLANIFICACION;;20 DE MAYO E/ TERRITORIAL Y AYESTARAN;31/01/1977;2302;7511;0;261;999;2;UP;05;0;
00262;MINISTERIO DE TRABAJO Y SEGURIDAD SOCIAL;;CALLE 23 NUMERO 105 E/ O Y P;31/01/1977;2302;7513;0;262;999;2;UP;05;0;
00263;MINISTERIO DE JUSTICIA;;CALLE O N0. 216 E/ 23 Y 25, VEDADO;31/01/1977;2302;7511;0;263;999;2;UP;05;0;
00264;MINISTERIO DE RELACIONES EXTERIORES;;CALZADA NO. 360, ENTRE G Y H, VEDADO;31/01/1977;2302;7521;0;264;999;2;UP;05;0;
00267;TRIBUNAL SUPREMO POPULAR;;CALLE AGUIAR, NO. 367, ENTRE OBRAPÍA Y OBISPO;31/01/1977;2304;7523;0;267;999;2;UP;05;0;
00268;FISCALIA GENERAL DE LA REPUBLICA;;AVENIDA PRIMERA NUMERO 1801 ENTRE LAS CALLES 18 Y 20, REPARTO MIRAMAR.;31/01/1977;2301;7523;0;268;999;2;UP;05;0;
00271;MINISTERIO DE LAS FUERZAS ARMADAS REVOLUCIONARIAS;;EDIFICIO SIERRA MAESTRA, AVENIDA DE RANCHO BOYEROS;31/01/1977;2302;7523;0;271;999;2;UP;05;0;
00272;MINISTERIO DEL INTERIOR;;;31/01/1977;2302;7523;0;272;999;2;UP;05;0;
00300;CONSEJO DE ESTADO;;COLON Y CARLOS MANUEL DE CESPEDES;31/01/1977;2302;7511;0;300;999;2;UP;05;0;
00301;ASAMBLEA NACIONAL DEL PODER POPULAR;;CALLE PRADO NO.422 ENTRE DRAGONES Y SAN JOSE;31/01/1977;2304;7511;0;301;999;2;UP;05;0;
00302;COMITE EJECUTIVO DEL CONSEJO DE MINISTRO;;PALACIO DE LA REVOLUCION;31/01/1977;2302;7511;0;302;999;2;UP;05;0;
00304;ADUANA GENERAL DE LA REPUBLICA;;CALLE 39 NO. 674, ESQUINA A 6, NUEVO VEDADO;31/01/1977;2302;7511;0;304;999;2;UP;05;0;00304
00310;PODER POPULAR PROVINCIAL DE PINAR DEL RIO;;MARTI NO. 164 E/ RAMON GONZALEZ CORO Y VOLCAN;31/01/1977;2108;7511;0;311;999;2;UP;05;1;
00311;PODER POPULAR MUNICIPAL DE SANDINO;;ZONA P S/N CIUDAD SANDINO;31/01/1977;2101;7511;0;311;999;2;UP;05;2;
00312;PODER POPULAR MUNICIPAL DE MANTUA;;CALLE JUAN BRUNO SAYAS NO. 314;31/01/1977;2102;7511;0;311;999;2;UP;05;2;00360
00313;PODER POPULAR MUNICIPAL DE MINAS DE MATAHAMBRE;;PASEO RUISENOR;31/01/1977;2103;7511;0;311;999;2;UP;05;2;
00314;PODER POPULAR MUNICIPAL DE VINALES;;CAMILO CIENFUEGOS NO. 2;31/01/1977;2104;7511;0;311;999;2;UP;05;2;
00315;PODER POPULAR MUNICIPAL DE LA PALMA;;MARTI NO. 87 E/ RIUS RIVERA Y CUARTELES;31/01/1977;2105;7511;0;311;999;2;UP;05;2;
00316;PODER POPULAR MUNICIPAL BAHIA HONDA;;AVE. 23 NO. 2814 E/ 30 Y 28;31/01/1977;2201;7511;0;326;999;2;UP;05;2;
00317;PODER POPULAR MUNICIPAL DE CANDELARIA;;CALLE 34 NO. 3500 E/ 35 Y 37;31/01/1977;2210;7511;0;326;999;2;UP;05;2;
00318;PODER POPULAR MUNICIPAL DE SAN CRISTOBAL;;RAFAEL PENA NO. 65 E/ IGNACIO HUMARA Y JOSE MARTI;31/01/1977;2211;7511;0;326;999;2;UP;05;2;
00319;PODER POPULAR MUNICIPAL DE LOS PALACIOS;;CALLE 20 NO. 1714 E/ 17 Y 19;31/01/1977;2106;7511;0;311;999;2;UP;05;2;
00321;PODER POPULAR MUNICIPAL DE CONSOLACION DEL SUR;;CALLE 53 NO. 6225 E/ 62 Y 64;31/01/1977;2107;7511;0;311;999;2;UP;05;2;00310
00322;PODER POPULAR MUNICIPAL DE PINAR DEL RIO;;EMILIO NUNEZ NO. 127, REPARTO CARLOS MANUEL;31/01/1977;2108;7511;0;311;999;2;UP;05;2;00310
00323;PODER POPULAR MUNICIPAL DE SAN LUIS;;JUANA ROMERO NO. 34;31/01/1977;2109;7511;0;311;999;2;UP;05;2;00310
00324;PODER POPULAR MUNICIPAL DE SAN JUAN Y MARTINEZ;;FRANCISCO RIVERA NO. 4 E/ LIBERTAD E ISABEL RUGES;31/01/1977;2110;7511;0;311;999;2;UP;05;2;
00325;PODER POPULAR MUNICIPAL DE GUANE;;CALLE IGNACIO RODRIGUEZ NO. 18;31/01/1977;2111;7511;0;311;999;2;UP;05;2;
00331;PODER POPULAR MUNICIPAL DE MARIEL;;AVE. 71 CARRETERA MARIEL, BOCA MARIEL;31/01/1977;2202;7511;0;326;999;2;UP;05;2;
00332;PODER POPULAR MUNICIPAL DE GUANAJAY;;AVE. 63 NO. 6412 E/ 64 Y 66;31/01/1977;2203;7511;0;326;999;2;UP;05;2;
00333;PODER POPULAR MUNICIPAL DE CAIMITO;;AVE. 41 NO. 3615 E/ 36 Y 38;31/01/1977;2204;7511;0;326;999;2;UP;05;2;
00334;PODER POPULAR MUNICIPAL DE BAUTA;;CALLE 144 # 25306 E/ 253 Y 255;31/01/1977;2205;7511;0;326;999;2;UP;05;2;
00335;PODER POPULAR MUNICIPAL DE SAN ANTONIO DE LOS BANOS;;AVE. 41 NO. 6015 E/ 60 Y 62;31/01/1977;2206;7511;0;326;999;2;UP;05;2;
00336;PODER POPULAR MUNICIPAL DE BEJUCAL;;CALLE 8 NO. 802 ESQ. 7;31/01/1977;2401;7511;0;327;999;2;UP;05;2;
00337;PODER POPULAR MUNICIPAL DE SAN JOSE DE LAS LAJAS;;CALLE 54 E/ 59 Y 63;31/01/1977;2402;7511;0;327;999;2;UP;05;2;
00338;PODER POPULAR MUNICIPAL DE JARUCO;;AVE. 23 N0. 2809 E/ 28 Y 30;31/01/1977;2403;7511;0;327;999;2;UP;05;2;
00339;PODER POPULAR MUNICIPAL DE SANTA CRUZ DEL NORTE;;CALLE 4TA NO. 913 E/ 9 Y 11;31/01/1977;2404;7511;0;327;999;2;UP;05;2;
00341;PODER POPULAR MUNICIPAL DE MADRUGA;;CALLE 26 NO. 2904 E/ 29 Y 31;31/01/1977;2405;7511;0;327;999;2;UP;05;2;
00342;PODER POPULAR MUNICIPAL DE NUEVA PAZ;;CALLE 12 NO. 1254 ESQ. 15;31/01/1977;2406;7511;0;327;999;2;UP;05;2;
00343;PODER POPULAR MUNICIPAL DE SAN NICOLAS;;CALLE 48 NO. 5302 E/ 53 Y 55;31/01/1977;2407;7511;0;327;999;2;UP;05;2;
00344;PODER POPULAR MUNICIPAL DE GUINES;;CALLE 94 NO. 8509 E/ 85 Y 91;31/01/1977;2408;7511;0;327;999;2;UP;05;2;
00345;PODER POPULAR MUNICIPAL DE MELENA DEL SUR;;AVE. 35 NO. 2605 E/ 26 Y 28;31/01/1977;2409;7511;0;327;999;2;UP;05;2;
00346;PODER POPULAR MUNICIPAL DE BATABANO;;CALLE 64 NO. 7325 E/ 73 Y 75;31/01/1977;2410;7511;0;327;999;2;UP;05;2;
00347;PODER POPULAR MUNICIPAL DE QUIVICAN;;CALLE 24 NO. 2301 E/ 23 Y 25;31/01/1977;2411;7511;0;327;999;2;UP;05;2;
00348;PODER POPULAR MUNICIPAL DE GUIRA DE MELENA;;AVE. 97 NO. 8006 E/ 88 Y 90;31/01/1977;2207;7511;0;326;999;2;UP;05;2;
00349;PODER POPULAR MUNICIPAL DE ALQUIZAR;;CALLE 76 NO. 8908 E/ 89 Y 91;31/01/1977;2208;7511;0;326;999;2;UP;05;2;
00351;PODER POPULAR MUNICIPAL DE ARTEMISA;;CALLE 48 NO. 2507 E/ 25 Y 27;31/01/1977;2209;7511;0;326;999;2;UP;05;2;
00360;PODER POPULAR PROVINCIAL LA HABANA;;AVE. LAS MISIONES NO. 25 ESQ. PENA POBRE;31/01/1977;2304;7511;0;313;999;2;UP;05;1;00360
00361;PODER POPULAR MUNICIPAL DE PLAYA;;42 NO. 511 ESQ. 7MA;31/01/1977;2301;7511;0;313;999;2;UP;05;2;
00362;PODER POPULAR MUNICIPAL DE PLAZA DE LA REVOLUCION;;CALZADA NO. 851 ESQ. A 4, VEDADO;31/01/1977;2302;7511;0;313;999;2;UP;05;2;
00363;PODER POPULAR MUNICIPAL DE CENTRO HABANA;;REINA NO. 67 ESQ. A ANGELES;31/01/1977;2303;7511;0;313;999;2;UP;05;2;
00364;PODER POPULAR MUNICIPAL DE LA HABANA VIEJA;;MURALLA NO. 1 E/ AVE DEL PUERTO Y OFICIOS;31/01/1977;2304;7511;0;313;999;2;UP;05;2;
00365;PODER POPULAR MUNICIPAL DE REGLA;;GUAICANAMAR NO. 1 E/ CESPEDES Y ARANGUREN;31/01/1977;2305;7511;0;313;999;2;UP;05;2;
00366;PODER POPULAR MUNICIPAL DE LA HABANA DEL ESTE;;35 NO. 1585 E/ 158 Y 160 ZONA 5, ALAMAR;31/01/1977;2306;7511;0;313;999;2;UP;05;2;
00367;PODER POPULAR MUNICIPAL DE GUANABACOA;;PEPE ANTONIO NO. 343 E/ JESUS MARIA Y DOCTOR MORA;31/01/1977;2307;7511;0;313;999;2;UP;05;2;
00368;PODER POPULAR MUNICIPAL DE SAN MIGUEL DEL PADRON;;CALZADA DE GUINES NO. 472 E/ B Y AVE. CALIFORNIA;31/01/1977;2308;7511;0;313;999;2;UP;05;2;
00369;PODER POPULAR MUNICIPAL DE DIEZ DE OCTUBRE;;SANTA CATALINA NO. 360 E/ CORTINA Y FIGUEROA;31/01/1977;2309;7511;0;313;999;2;UP;05;2;
00371;PODER POPULAR MUNICIPAL DE CERRO;;CALZADA DEL CERRO NO. 1265 E/ CALZADA DE BUENOS AIRES Y CALLEJON ECHEVARRIA;31/01/1977;2310;7511;0;313;999;2;UP;05;2;
00372;PODER POPULAR MUNICIPAL DE MARIANAO;;49 NO. 12024 E/ 120 Y 122, EDIFICIO LEVANTAN;31/01/1977;2311;7511;0;313;999;2;UP;05;2;
00373;PODER POPULAR MUNICIPAL DE LA LISA;;AVE. 49 E/ 200 Y 204;31/01/1977;2312;7511;0;313;999;2;UP;05;2;
00374;PODER POPULAR MUNICIPAL DE BOYEROS;;AVE. INDEPENDENCIA NO. 31103 E/ 311 Y 313;31/01/1977;2313;7511;0;313;999;2;UP;05;2;
00375;PODER POPULAR MUNICIPAL DE ARROYO NARANJO;;CALZADA DE BEJUCAL S/N ENTRE 6TA Y 7MA, RPTO. POEY;31/01/1977;2314;7511;0;313;999;2;UP;05;2;
00376;PODER POPULAR MUNICIPAL DE COTORRO;;AVE. 101 NO. 1428 E/ 14 Y 16;31/01/1977;2315;7511;0;313;999;2;UP;05;2;
00380;PODER POPULAR PROVINCIAL DE MATANZAS;;AYUNTAMIENTO E/ MILANES Y CONTRERAS;31/01/1977;2501;7511;0;314;999;2;UP;05;1;
00381;PODER POPULAR MUNICIPAL DE MATANZAS;;SANTA RITA FINAL NO. 25402. PLAYA.;31/01/1977;2501;7511;0;314;999;2;UP;05;2;
00382;PODER POPULAR MUNICIPAL DE CARDENAS;;CESPEDES NO. 662 E/ CRISTINA Y VELAZQUEZ;31/01/1977;2502;7511;0;314;999;2;UP;05;2;
00383;PODER POPULAR MUNICIPAL DE VARADERO;;CALLE 40 E/ 1RA Y AUTOPISTA. VARADERO;31/01/1977;2502;7511;0;314;999;2;UP;05;2;
00384;PODER POPULAR MUNICIPAL DE MARTI;;MACEO NO. 265.;31/01/1977;2503;7511;0;314;999;2;UP;05;2;
00385;PODER POPULAR MUNICIPAL DE COLON;;RICARDO TRUJILLO NO. 4 E/ GONZALO DE QUESADA Y CAMILO CIENFUEGOS.;31/01/1977;2504;7511;0;314;999;2;UP;05;2;
00386;PODER POPULAR MUNICIPAL DE PERICO;;MARTI NO. 181 E/ MACEO Y GONZALEZ;31/01/1977;2505;7511;0;314;999;2;UP;05;2;
00387;PODER POPULAR MUNICIPAL DE JOVELLANOS;;CALLE 15 NO. 1410 E/ 14 Y 16.;31/01/1977;2506;7511;0;314;999;2;UP;05;2;
00388;PODER POPULAR MUNICIPAL DE PEDRO BETANCOURT;;CALLE 24 NO. 2309 E/ 25 Y 23.;31/01/1977;2507;7511;0;314;999;2;UP;05;2;
00389;PODER POPULAR MUNICIPAL DE LIMONAR;;NELSON FERNANDEZ E/ M.GOMEZ Y A.MACEO;31/01/1977;2508;7511;0;314;999;2;UP;05;2;
00391;PODER POPULAR MUNICIPAL DE UNION DE REYES;;GENERAL BETANCOURT S/N E/ GENERAL LACRET Y FRANK PAIS.;31/01/1977;2509;7511;0;314;999;2;UP;05;2;
00392;PODER POPULAR MUNICIPAL DE CIENAGA DE ZAPATA;;ENTRONQUE PLAYA LARGA.;31/01/1977;2510;7511;0;314;999;2;UP;05;2;
00393;PODER POPULAR MUNICIPAL DE JAGUEY GRANDE;;CALLE 56 NO. 1312 E/ 13 Y 15.;31/01/1977;2511;7511;0;314;999;2;UP;05;2;
00394;PODER POPULAR MUNICIPAL DE CALIMETE;;INDEPENDENCIA NO. 72 E/ 6 Y 8.;31/01/1977;2512;7511;0;314;999;2;UP;05;2;
00395;PODER POPULAR MUNICIPAL DE LOS ARABOS;;CALLE MACEO NO. 25.;31/01/1977;2513;7511;0;314;999;2;UP;05;2;
00410;PODER POPULAR PROVINCIAL DE VILLA CLARA;;MACEO NO. 383 E/N GENERAL ROLOFF Y SINDICO;31/01/1977;2609;7511;0;315;999;2;UP;05;1;
00411;PODER POPULAR MUNICIPAL DE CORRALILLO;;CALLE LEONCIO VIDAL NO. 58, ENTRE MARTI Y RAFAEL IZQUIERDO;31/01/1977;2601;7511;0;315;999;2;UP;05;2;00411
00412;PODER POPULAR MUNICIPAL DE QUEMADO DE GUINES;;2DA DEL OESTE NO. 8 E/N 1RA Y AVENIDA SUR;31/01/1977;2602;7511;0;315;999;2;UP;05;2;
00413;PODER POPULAR MUNICIPAL DE SAGUA LA GRANDE;;CARMEN RIBALTA NO.179 E/N CLARA BARTON Y LIBERTADORES;31/01/1977;2603;7511;0;315;999;2;UP;05;2;
00414;PODER POPULAR MUNICIPAL DE ENCRUCIJADA;;AVE. JOSE MARTI NO. 7 E/ 1RA DEL OESTE Y CALZADA 26 DE JULIO.;31/01/1977;2604;7511;0;315;999;2;UP;05;2;
00415;PODER POPULAR MUNICIPAL DE CAMAJUANI;;MACEO NO.1 ENTRE INDEPENDENCIA Y MARTI;31/01/1977;2605;7511;0;315;999;2;UP;05;2;00410
00416;PODER POPULAR MUNICIPAL DE CAIBARIEN;;AVENIDA 7MA NO. 803 E/N 8 Y 10;31/01/1977;2606;7511;0;315;999;2;UP;05;2;
00417;PODER POPULAR MUNICIPAL DE REMEDIOS;;CALLE ADOLFO RUIZ, NUMERO 112, ENTRE INDEPENDENCIA Y GENERAL CARRILLO;31/01/1977;2607;7511;0;315;999;2;UP;05;2;
00418;PODER POPULAR MUNICIPAL DE PLACETAS;;1RA NORTE E/N 1RA Y 2DA OESTE;31/01/1977;2608;7511;0;315;999;2;UP;05;2;
00419;PODER POPULAR MUNICIPAL DE SANTA CLARA;;JUAN BRUNO ZAYAS NO. 257 E/N SAN MIGUEL Y NAZARENO;31/01/1977;2609;7511;0;315;999;2;UP;05;2;
00421;PODER POPULAR MUNICIPAL DE CIFUENTES;;MARTI NO. 107 E/ CALIXTO GARCIA Y J. RAMON LANZA;31/01/1977;2610;7511;0;315;999;2;UP;05;2;
00422;PODER POPULAR MUNICIPAL DE SANTO DOMINGO;;FRUCTUOSO RODRIGUEZ NO. 45 E/ MACEO Y JESUS PEREZ;31/01/1977;2611;7511;0;315;999;2;UP;05;2;
00423;PODER POPULAR MUNICIPAL DE RANCHUELO;;JUAN B. CONTRERAS NO. 1 E/N C. GARCIA Y RAMIRO LAVANDERO.;31/01/1977;2612;7511;0;315;999;2;UP;05;2;
00424;PODER POPULAR MUNICIPAL DE MANICARAGUA;;AVENIDA LIBERTAD NUMERO 8 ENTRE JUAN BRUNO ZAYAS Y ORIENTE;31/01/1977;2613;7511;0;315;999;2;UP;05;2;
00430;PODER POPULAR PROVINCIAL DE CIENFUEGOS;;AVE. 54 NO. 2706 E/ 27 Y 29;31/01/1977;2707;7511;0;316;999;2;UP;05;1;
00431;PODER POPULAR MUNICIPAL DE AGUADA DE PASAJEROS;;CALIXTO GARCIA NO. 64 ENTRE MACEO Y CESPEDES;31/01/1977;2701;7511;0;316;999;2;UP;05;2;00430
00432;PODER POPULAR MUNICIPAL DE RODAS;;CALLE CESPEDES NO. 25 E/ MACEO Y CALIXTO GARCIA;31/01/1977;2702;7511;0;316;999;2;UP;05;2;
00433;PODER POPULAR MUNICIPAL DE PALMIRA;;CAMILO CIENFUEGOS NO. 134 E/ ESTRADA PALMA Y CERICE;31/01/1977;2703;7511;0;316;999;2;UP;05;2;
00434;PODER POPULAR MUNICIPAL DE LAJAS;;DR. MACHIN NO. 79 E/ GOITIZOLO Y MARTI;31/01/1977;2704;7511;0;316;999;2;UP;05;2;
00435;PODER POPULAR MUNICIPAL DE CRUCES;;ESQUERRA NO. 617 E/ PADRE LAS CASAS Y SERAFIN SANCHEZ;31/01/1977;2705;7511;0;316;999;2;UP;05;2;
00436;PODER POPULAR MUNICIPAL DE CUMANAYAGUA;;PASEO MARTI NO. 61 E/ CANDELARIA Y ELADIO MACHIN;31/01/1977;2706;7511;0;316;999;2;UP;05;2;
00437;PODER POPULAR MUNICIPAL DE CIENFUEGOS;;CALLE 41 NO. 5612 E/ 56 Y 58;31/01/1977;2707;7511;0;316;999;2;UP;05;2;
00438;PODER POPULAR MUNICIPAL DE ABREUS;;AVE. LIBERTAD NO. 89 E/ S. ENRIQUE Y J. RODRIGUEZ;31/01/1977;2708;7511;0;316;999;2;UP;05;2;
00440;PODER POPULAR PROVINCIAL DE SANCTI SPIRITUS;;CALLE CUARTEL S/N E/ ISABEL MARIA DE VALDIVIA Y AVE.DE LOS MARTIRES RPTO OLIVOS 1;31/01/1977;2807;7511;0;317;999;2;UP;05;1;
00441;PODER POPULAR MUNICIPAL DE YAGUAJAY;;MACEO NO. 7 E/ZAYAS Y PEDRO DIAZ.;31/01/1977;2801;7511;0;317;999;2;UP;05;2;
00442;PODER POPULAR MUNICIPAL DE JATIBONICO;;PASEO MARTI NO. 23 E/MANUEL FEIJOO Y MAXIMO GOMEZ.;31/01/1977;2802;7511;0;317;999;2;UP;05;2;
00443;PODER POPULAR MUNICIPAL DE TAGUASCO;;CALLE PEDRO MARIA RODRIGUEZ NO. 21 E/ JOSE ANTONIO ECHEVARRIA Y ANTONIO RIVEROL ACOSTA;31/01/1977;2803;7511;0;317;999;2;UP;05;2;
00444;PODER POPULAR MUNICIPAL DE CABAIGUAN;;DIONISIO RODRIGUEZ NO. 49;31/01/1977;2804;7511;0;317;999;2;UP;05;2;
00445;PODER POPULAR MUNICIPAL DE FOMENTO;;CESPEDES NO. 115 E/ AGUILERA Y JOSE DEL C. HERNANDEZ;31/01/1977;2805;7511;0;317;999;2;UP;05;2;
00446;PODER POPULAR MUNICIPAL DE TRINIDAD;;ANTONIO GUITERAS NO. 1 E/JOSE MARTI Y FRANCISCO PATERSON.;31/01/1977;2806;7511;0;317;999;2;UP;05;2;
00447;PODER POPULAR MUNICIPAL DE SANCTI SPIRITUS;;INDEPENDENCIA NO. 16 (SUR) E/ CERVANTES Y HONORATO;31/01/1977;2807;7511;0;317;999;2;UP;05;2;
00448;PODER POPULAR MUNICIPAL DE LA SIERPE;;AVENIDA 4, ENTRE CALLE 9 Y 11;31/01/1977;2808;7511;0;317;999;2;UP;05;2;00440
00450;PODER POPULAR PROVINCIAL DE CIEGO DE AVILA;;CALLE 2 ESQ. MAXIMO GOMEZ;31/01/1977;2908;7511;0;318;999;2;UP;05;1;
00451;PODER POPULAR MUNICIPAL DE CHAMBAS;;MARTI NO. 11 E/ AGRAMONTE Y FELIX VARELA;31/01/1977;2901;7511;0;318;999;2;UP;05;2;
00452;PODER POPULAR MUNICIPAL DE MORON;;CALLE SERAFINA NO. 172 ENTRE 7 Y 8;31/01/1977;2902;7511;0;318;999;2;UP;05;2;00450
00453;PODER POPULAR MUNICIPAL DE BOLIVIA;;SANCHEZ PINARES NO. 10;31/01/1977;2903;7511;0;318;999;2;UP;05;2;
00454;PODER POPULAR MUNICIPAL DE PRIMERO DE ENERO;;CALLE 4 NO. 31 E/ M Y N;31/01/1977;2904;7511;0;318;999;2;UP;05;2;
00455;PODER POPULAR MUNICIPAL DE CIRO REDONDO;;ENRIQUE VARONA NO. 2 ESQ. CAMILO CIENFUEGOS;31/01/1977;2905;7511;0;318;999;2;UP;05;2;
00456;PODER POPULAR MUNICIPAL DE FLORENCIA;;CALLE : EDIFICIO NO. 2 ENTRE A ESTE Y B ESTE;31/01/1977;2906;7511;0;318;999;2;UP;05;2;
00457;PODER POPULAR MUNICIPAL DE MAJAGUA;;LIBERTAD NO. 35 E/ PASEO MARTI Y JUSTO SANCHEZ;31/01/1977;2907;7511;0;318;999;2;UP;05;2;
00458;PODER POPULAR MUNICIPAL DE CIEGO DE AVILA;;CALLE INDEPENDENCIA NO. 1 ENTRE MARCIAL GOMEZ Y HONORATO DEL CASTILLO;31/01/1977;2908;7511;0;318;999;2;UP;05;2;
00459;PODER POPULAR MUNICIPAL DE VENEZUELA;;VIA VENEZUELA NO. 9 E/ 6 Y 7;31/01/1977;2909;7511;0;318;999;2;UP;05;2;
00461;PODER POPULAR MUNICIPAL DE BARAGUA;;CALLE B NO. 20 E/ 2DA Y 3RA;31/01/1977;2910;7511;0;318;999;2;UP;05;2;
00470;PODER POPULAR PROVINCIAL DE CAMAGUEY;;AVENIDA 26 DE JULIO;31/01/1977;3008;7511;0;319;999;2;UP;05;1;
00471;PODER POPULAR MUNICIPAL DE CARLOS MANUEL DE CESPEDES;;CALLE 17 NO. 538 E/ 16 Y18;31/01/1977;3001;7511;0;319;999;2;UP;05;2;
00472;PODER POPULAR MUNICIPAL DE ESMERALDA;;MACEO NO. 1 E/ PANCHITO GOMEZ Y CIRCUITO NORTE;31/01/1977;3002;7511;0;319;999;2;UP;05;2;
00473;PODER POPULAR MUNICIPAL DE SIERRA DE CUBITAS;;AVE. MARIO HERRERO TOSCANO NO. 186;31/01/1977;3003;7511;0;319;999;2;UP;05;2;
00474;PODER POPULAR MUNICIPAL DE MINAS;;CALLE CISNEROS NO. 242 E/ AYESTERAN Y AGUERO;31/01/1977;3004;7511;0;319;999;2;UP;05;2;
00475;PODER POPULAR MUNICIPAL DE NUEVITAS;;MAXIMO GOMEZ NO. 74 E/ J. AGUERO Y CESPEDES;31/01/1977;3005;7511;0;319;999;2;UP;05;2;
00476;PODER POPULAR MUNICIPAL DE GUAIMARO;;GABRIEL GARCIA NO. 31 E/ MARTI Y BENITO MORELL;31/01/1977;3006;7511;0;319;999;2;UP;05;2;
00477;PODER POPULAR MUNICIPAL DE SIBANICU;;CAMILO CIENFUEGOS NO. 80 E/ F. PAIS Y C. CENTRAL;31/01/1977;3007;7511;0;319;999;2;UP;05;2;
00478;PODER POPULAR MUNICIPAL DE CAMAGUEY;;CISNEROS NO. 201 E/ MARTI Y HERMANOS AGUERO;31/01/1977;3008;7511;0;319;999;2;UP;05;2;
00479;PODER POPULAR MUNICIPAL DE FLORIDA;;CARRETERA CENTRAL ESQ. MAXIMO GOMEZ;31/01/1977;3009;7511;0;319;999;2;UP;05;2;
00481;PODER POPULAR MUNICIPAL DE VERTIENTES;;CALLE C NO. 34 E/ 4TA Y 5TA;31/01/1977;3010;7511;0;319;999;2;UP;05;2;
00482;PODER POPULAR MUNICIPAL DE JIMAGUAYU;;PUEBLO DE JIMAGUAYU;31/01/1977;3011;7511;0;319;999;2;UP;05;2;
00483;PODER POPULAR MUNICIPAL DE NAJASA;;CARRETERA CUBANACAN CUATRO CAMINOS;31/01/1977;3012;7511;0;319;999;2;UP;05;2;
00484;PODER POPULAR MUNICIPAL DE SANTA CRUZ DEL SUR;;CALLE 1RA NO. 210 E/ G Y J;31/01/1977;3013;7511;0;319;999;2;UP;05;2;
00490;PODER POPULAR PROVINCIAL DE LAS TUNAS;;AVE 30 DE NOVIEMBRE S/N;31/01/1977;3105;7511;0;320;999;2;UP;05;1;
00491;PODER POPULAR MUNICIPAL DE MANATI;;CONRADO BENITEZ NO. 17;31/01/1977;3101;7511;0;320;999;2;UP;05;2;
00492;PODER POPULAR MUNICIPAL DE PUERTO PADRE;;AVE LIBERTAD NO. 88;31/01/1977;3102;7511;0;320;999;2;UP;05;2;
00493;PODER POPULAR MUNICIPAL DE JESUS MENENDEZ;;CALLE 20 NO. 6 , CENICERO, BATEY;31/01/1977;3103;7511;0;320;999;2;UP;05;2;
00494;PODER POPULAR MUNICIPAL DE MAJIBACOA;;CALLE 1 NO. 72 CALIXTO;31/01/1977;3104;7511;0;320;999;2;UP;05;2;
00495;PODER POPULAR MUNICIPAL DE LAS TUNAS;;FRANCISCO VARONA NO. 7 E/ MENOCAL Y LORA;31/01/1977;3105;7511;0;320;999;2;UP;05;2;
00496;PODER POPULAR MUNICIPAL DE JOBABO;;ROSENDO ARTEAGA S/N;31/01/1977;3106;7511;0;320;999;2;UP;05;2;
00497;PODER POPULAR MUNICIPAL DE COLOMBIA;;AVE CANDIDO GONZALEZ NO. 180 E/ 17 Y 19, RPTO. PROGRESO;31/01/1977;3107;7511;0;320;999;2;UP;05;2;
00498;PODER POPULAR MUNICIPAL DE AMANCIO;;AVE SERGIO REINO NO. 24;31/01/1977;3108;7511;0;320;999;2;UP;05;2;
00501;COMITE CENTRAL DEL PARTIDO COMUNISTA DE CUBA;PCC;PASEO S/N E/ BOYEROS Y CARLOS.M. DE CESPEDES;31/01/1977;2302;9792;0;501;999;1;OPM;29;0;00501
00502;UNION DE JOVENES COMUNISTAS;UJC;AVE. DE LAS MISIONES NO. 5 Y 7 E/ HABANA Y PENA POBRE;31/01/1977;2304;9792;0;502;999;1;OPM;29;0;
00504;CENTRAL DE TRABAJADORES DE CUBA;CTC;CALLE SAN CARLOS, ESQ PENALVER;31/01/1977;2303;9720;0;504;999;1;OPM;29;0;
00505;FEDERACION DE MUJERES CUBANAS;FMC;PASEO NO. 260, ESQ. A 13, VEDADO;31/01/1977;2302;9792;0;505;999;1;OPM;29;0;
00506;COMITES DE DEFENSA DE LA REVOLUCION;CDR;CALLE LINEA NO. 157 ENTRE L Y K, VEDADO;31/01/1977;2302;9792;0;506;999;1;OPM;29;0;
00507;ASOCIACION NACIONAL DE AGRICULTORES PEQUENOS;ANAP;CALLE 13 NO. 206 ENTRE H Y I;31/01/1977;2302;9792;0;507;999;1;AS;30;0;
00510;PODER POPULAR PROVINCIAL DE HOLGUIN;;PROLONGACION DE FREXES S/N E/ GONZALEZ CLAVEL E INDEPENDENCIA, VISTA ALEGRE;31/01/1977;3206;7511;0;321;999;2;UP;05;1;
00511;PODER POPULAR MUNICIPAL DE GIBARA;;CALLE LUZ CABALLERO NO. 19 E/ INDEPENDENCIA Y SARTORIO;31/01/1977;3201;7511;0;321;999;2;UP;05;2;
00512;PODER POPULAR MUNICIPAL DE RAFAEL FREIRE;;CALLE 1RA NO. 16;31/01/1977;3202;7511;0;321;999;2;UP;05;2;
00513;PODER POPULAR MUNICIPAL DE BANES;;CALLE GENERAL MARRERO NO. 1101 E/ BAYAMO Y MAXIMO GOMEZ;31/01/1977;3203;7511;0;321;999;2;UP;05;2;
00514;PODER POPULAR MUNICIPAL DE ANTILLA;;CALLE 28 DE ENERO NO. 47;31/01/1977;3204;7511;0;321;999;2;UP;05;2;
00515;PODER POPULAR MUNICIPAL DE BAGUANOS;;CALLE 11 NO. 2 E/ G E I, LA PELOTA;31/01/1977;3205;7511;0;321;999;2;UP;05;2;
00516;PODER POPULAR MUNICIPAL DE HOLGUIN;;CALLE AGRAMONTE NO. 184 E/ LIBERTAD Y MACEO;31/01/1977;3206;7511;0;321;999;2;UP;05;2;
00517;PODER POPULAR MUNICIPAL DE CALIXTO GARCIA;;CALLE PATRICIO LUBUMBA NO. 43 E/ FINAL DE MANUEL ASCUNCE Y JESUS MENENDEZ;31/01/1977;3207;7511;0;321;999;2;UP;05;2;
00518;PODER POPULAR MUNICIPAL DE CACOCUM;;CALLE CAMILO CIENFUEGOS NO. 3 E/ FRANK PAIS Y RUBEN BATISTA;31/01/1977;3208;7511;0;321;999;2;UP;05;2;
00519;PODER POPULAR MUNICIPAL DE URBANO NORIS;;CALLE 31 NO. 2914 E/ 14 Y 14 A;31/01/1977;3209;7511;0;321;999;2;UP;05;2;
00521;PODER POPULAR MUNICIPAL DE CUETO;;CALLE RUBEN CASAUS NO. 51 E/ CESPEDES Y MACEO;31/01/1977;3210;7511;0;321;999;2;UP;05;2;
00522;PODER POPULAR MUNICIPAL DE MAYARI;;CALLE MAXIMO GOMEZ NO. 12 BAJOS E/ C.M. DE CESPEDES Y L. VIDAL;31/01/1977;3211;7511;0;321;999;2;UP;05;2;
00523;PODER POPULAR MUNICIPAL DE FRANK PAIS;;CALLE MARTI NO. 71;31/01/1977;3212;7511;0;321;999;2;UP;05;2;
00524;PODER POPULAR MUNICIPAL DE SAGUA DE TANAMO;;LOS MACEOS NO. 17;31/01/1977;3213;7511;0;321;999;2;UP;05;2;
00525;PODER POPULAR MUNICIPAL DE MOA;;CALLE CAMILO CIENFUEGOS NO. 163;31/01/1977;3214;7511;0;321;999;2;UP;05;2;
00530;PODER POPULAR PROVINCIAL DE GRANMA;;CALLE 6 NO. 50 E/ AVE. FRANK PAIS Y 1RA RPTO.JESUS MENENDEZ;31/01/1977;3304;7511;0;322;999;2;UP;05;1;
00531;PODER POPULAR MUNICIPAL DE RIO CAUTO;;ANTONIO MACEO NO.33;31/01/1977;3301;7511;0;322;999;2;UP;05;2;
00532;PODER POPULAR MUNICIPAL DE CAUTO CRISTO;;JULIO ANTONIO MELLA S/N CAUTO CRISTO;31/01/1977;3302;7511;0;322;999;2;UP;05;2;
00533;PODER POPULAR MUNICIPAL DE JIGUANI;;GRAL GARCIA NO. 125 E/ WILLIAN SOLER Y RAMON GOMEZ;31/01/1977;3303;7511;0;322;999;2;UP;05;2;
00534;PODER POPULAR MUNICIPAL DE BAYAMO;;GENERAL GARCIA NO. 13 E/ MACEO Y CANDUCHA FIGUEREDO;31/01/1977;3304;7511;0;322;999;2;UP;05;2;
00535;PODER POPULAR MUNICIPAL DE YARA;;ANTONIO MACEO NO. 83 E/ 10 DE OCTUBRE Y GRITO DE YARA;31/01/1977;3305;7511;0;322;999;2;UP;05;2;
00536;PODER POPULAR MUNICIPAL DE MANZANILLO;;LUZ CABALLERO NO. 84 / CALIXTO GARCIA Y DR.CODINA;31/01/1977;3306;7511;0;322;999;2;UP;05;2;
00537;PODER POPULAR MUNICIPAL DE CAMPECHUELA;;REPUBLICA NO. 38 E/ 27 DE NOVIEMBRE Y COLISEO;31/01/1977;3307;7511;0;322;999;2;UP;05;2;
00538;PODER POPULAR MUNICIPAL DE MEDIA LUNA;;ANSELMO VEGA NO. 10;31/01/1977;3308;7511;0;322;999;2;UP;05;2;
00539;PODER POPULAR MUNICIPAL DE NIQUERO;;PLACIDO NO. 9 E/ MAXIMO GOMEZ Y CESPEDES;31/01/1977;3309;7511;0;322;999;2;UP;05;2;
00541;PODER POPULAR MUNICIPAL DE PILON;;1RO DE MAYO NO. 22;31/01/1977;3310;7511;0;322;999;2;UP;05;2;
00542;PODER POPULAR MUNICIPAL DE BARTOLOME MASO;;AVE. BARTOLOME MASO NO. 34 ESQ. ANTONIO GUITERA;31/01/1977;3311;7511;0;322;999;2;UP;05;2;
00543;PODER POPULAR MUNICIPAL DE BUEY ARRIBA;;CORONEL LIENS NO. 215 E/ PEDRO NIETO Y CRISTINO NARANJO;31/01/1977;3312;7511;0;322;999;2;UP;05;2;
00544;PODER POPULAR MUNICIPAL DE GUISA;;MILANES NO. 160 ALTO E/ MARTI Y VICTOR RAMOS;31/01/1977;3313;7511;0;322;999;2;UP;05;2;
00550;PODER POPULAR PROVINCIAL DE SANTIAGO DE CUBA;;AGUILERA S/N E/ CARNICERIA Y SAN FELIX;31/01/1977;3406;7511;0;323;999;2;UP;05;1;
00551;PODER POPULAR MUNICIPAL DE CONTRAMAESTRE;;CALLE 13 NO. 67, RPTO. RODOLFO RODRIGUEZ;31/01/1977;3401;7511;0;323;999;2;UP;05;2;
00552;PODER POPULAR MUNICIPAL DE MELLA;;CALLE CENTRAL NO. 12;31/01/1977;3402;7511;0;323;999;2;UP;05;2;
