70101;COOPERATIVA AMYAIR CONFIANZA, DE SERVICIOS CONSTRUCTIVOS-INGENIEROS ESPECIALIZADOS.;AMYAIR;CALLE 15 NO. 6207, ENTRE 62 Y 64;19/06/2013;2301;4530;0;126;999;1;CNoA;08;5;
70102;COOPERATIVA NO AGROPECUARIA EL MARANON;;CALLE RAFAEL PEÑA S/N ENTRE CALLE MARTI Y LINEA.;20/06/2013;2211;5311;0;326;999;1;CNoA;08;5;
70103;COOPERATIVA NO AGROPECUARIA LA PLACITA;;CALLE 42 ENTRE 29 Y CAMPO.;20/06/2013;2210;5311;0;326;999;1;CNoA;08;5;
70104;COOPERATIVA NO AGROPECUARIA 26 DE JULIO;;CALLE 51 S/N ENTRE 41 Y 43.;20/06/2013;2206;5311;0;326;999;1;CNoA;08;5;
70105;COOPERATIVA NO AGROPECUARIA LA POPULAR;;CALLE 84 NO. 9302 ENTRE 93 Y 95.;20/06/2013;2207;5311;0;326;999;1;CNoA;08;5;
70106;COOPERATIVA NO AGROPECUARIA LA VICTORIA;;AVE. 25 ENTRE 30 Y 32.;21/06/2013;2201;5311;0;326;999;1;CNoA;08;5;
70107;COOPERATIVA NO AGROPECUARIA ISMAEL CEJAS;;CALLE 88 NO. 5701 ENTRE 57 Y 61;21/06/2013;2203;5311;0;326;999;1;CNoA;08;5;
70108;COOPERATIVA NO AGROPECUARIA LAS CANAS;;CALLE 14 NO. 504 ENTRE 5 Y 7, LAS CAÑAS.;21/06/2013;2209;5311;0;326;999;1;CNoA;08;5;
70109;COOPERATIVA NO AGROPECUARIA LA AVENIDA;;CALLE 40 ESQUINA 23.;21/06/2013;2209;5311;0;326;999;1;CNoA;08;5;
70110;COOPERATIVA NO AGROPECUARIA EL CAIMITO;;CALLE 52 ENTRE 41 Y 39, CAYAGUAZAL;21/06/2013;2204;5311;0;326;999;1;CNoA;08;5;
70111;COOPERATIVA DE SERVICIOS TECNICOS CONSTRUCTIVOS;MICARAL;CALLE 3RA NO. 3 APART. 3 ENTRE F Y G.;21/06/2013;2302;4520;0;126;999;1;CNoA;08;5;
70112;COOPERATIVA MERCADO AGROPECUARIO 30 Y 33;;CALLE 33, NO. 3006 ENTRE 30 Y 34.;21/06/2013;2301;5311;0;313;999;1;CNoA;08;5;
70113;COOPERATIVA CAMILO CIENFUEGOS GORRIARAN;;CALLE 146 ENTRE 249 Y 251 NO. 24903;21/06/2013;2205;5311;0;326;999;1;CNoA;08;5;
70114;COOPERATIVA NO AGROPECUARIA MARIEL;;CALLE 132 ENTRE 69 Y 71.;21/06/2013;2202;5311;0;326;999;1;CNoA;08;5;
70115;COOPERATIVA NO AGROPECUARIA MANOLITO AGUIAR;;AVE. 1RA S/N ENTRE 160 Y 160-A, PLAYA BARACOA;24/06/2013;2205;5311;0;326;999;1;CNoA;08;5;
70116;COOPERATIVA MERCADO AGROPECUARIO LOMA Y TULIPAN;;CALLE LOMA, ESQUINA A TULIPAN;24/06/2013;2302;5311;0;313;999;1;CNoA;08;5;
70117;COOPERATIVA MERCADO AGROPECUARIO 13 Y 62;;AVE. 13, ENTRE 62 Y 64;24/06/2013;2301;5311;0;313;999;1;CNoA;08;5;
70118;COOPERATIVA MERCADO AGROPECUARIO EL ALMENDARES;;AVE. 19 NO.7801, ENTRE 78 Y 80;24/06/2013;2301;5311;0;313;999;1;CNoA;08;5;
70119;COOPERATIVA MERCADO AGROPECUARIO SANTA FELICIA;;CALLE 49, ESQUINA A 88;24/06/2013;2311;5311;0;313;999;1;CNoA;08;5;
70120;COOPERATIVA DE SERVICIOS DE CONSTRUCCION;SERCONST;CALLE CALZADA NO. 406, ENTRE F Y G.;24/06/2013;2302;4520;0;126;999;1;CNoA;08;5;
70122;COOPERATIVA MERCADO AGROPECUARIO EL NINO;;CALLE OCTAVA ENTRE PRIMERA Y TERCERA, REPARTO MAÑANA.;24/06/2013;2307;5311;0;313;999;1;CNoA;08;5;
70123;COOPERATIVA MERCADO AGROPECUARIO COMPLEJO 58-B;;CALLE 58 B ENTRE 47 Y 49;25/06/2013;2301;5311;0;313;999;1;CNoA;08;5;
70124;COOPERATIVA MERCADO AGROPECUARIO SANTA FE;;AVE. 1RA B, ENTRE 296 Y 298;25/06/2013;2301;5311;0;313;999;1;CNoA;08;5;
70125;COOPERATIVA CONSTRUCCIONES LAPINET;;ALFREDO HERNANDEZ NO. 6 ENTRE LEPANTO Y CUARTEL, OLIVOS 1;25/06/2013;2807;4520;0;126;999;1;CNoA;08;5;
70126;COOPERATIVA DE SERVICIOS TECNICOS ESPECIALIZADOS FRIO SISTEM;FRIO SISTEM;CALLE GELABERT NO. 60 ALTOS, ENTRE SAN MIGUEL Y LAGUERUELA;25/06/2013;2309;4530;0;126;999;1;CNoA;08;5;
70127;RECICLAJE DE DESECHOS SAN JOSE DE LAS LAJAS;;AVE. 29 CARRETERA RANCHO ALTO;25/06/2013;2402;3950;0;102;999;1;CNoA;08;5;
70128;COOPERATIVA MERCADO AGROPECUARIO P-12;;CALLE 316, ESQUINA A 17;25/06/2013;2301;5311;0;313;999;1;CNoA;08;5;
70129;COOPERATIVA MERCADO AGROPECUARIO EL DELFIN;;CALLE 1RA, NO. 8603A, ENTRE 86 Y 89, LOCALIDAD COJIMAR;25/06/2013;2306;5311;0;313;999;1;CNoA;08;5;
70131;COOPERATIVA MERCADO AGROPECUARIO EL GALLO;;CALLE 83 S/N, ENTRE 152 Y 156;25/06/2013;2312;5311;0;313;999;1;CNoA;08;5;
70132;COOPERATIVA MERCADO AGROPECUARIO VIVES;;CALLE VIVES, ESQUINA RASTRO;25/06/2013;2304;5311;0;313;999;1;CNoA;08;5;
70133;COOPERATIVA MERCADO AGROPECUARIO LA KATHERINE;;CALLE REVILLAGIGEDO NO. 206, ENTRE MISION Y ESPERANZA;25/06/2013;2304;5311;0;313;999;1;CNoA;08;5;
70134;COOPERATIVA NO AGROPECUARIA DESARROLLO LOCAL CUBA-VENEZUELA;;CALLE 68 ENTRE 48 Y 49;25/06/2013;2402;5311;0;327;999;1;CNoA;08;5;
70136;COOPERATIVA NO AGROPECUARIA EL MOLINO;;CALLE 28 ENTRE 41 Y 43;25/06/2013;2409;5311;0;327;999;1;CNoA;08;5;
70137;COOPERATIVA MERCADO AGROPECUARIO 40-A;;CALLE 40-A, ENTRE 1RA Y 3RA;26/06/2013;2301;5311;0;313;999;1;CNoA;08;5;
70138;COOPERATIVA MERCADO AGROPECUARIO EL CANO;;CALLE 284, ENTRE 81 Y 83;26/06/2013;2312;5311;0;313;999;1;CNoA;08;5;
70139;COOPERATIVA MERCADO AGROPECUARIO LA AUTENTICA;;CALLE 56 ENTRE 160 Y 162-C, ZONA 6, ALAMAR;26/06/2013;2306;5311;0;313;999;1;CNoA;08;5;
70140;COOPERATIVA MERCADO AGROPECUARIO LA UNION;;CALLE 15 NO. 492, ESQUINA A 90, LOCALIDAD GUITERAS;26/06/2013;2306;5311;0;313;999;1;CNoA;08;5;
70141;COOPERATIVA MERCADO AGROPECUARIO EL PLAYERO;;CALLE 464 NO. 517, ENTRE 5TA Y 7MA, LOCALIDAD GUANABO;26/06/2013;2306;5311;0;313;999;1;CNoA;08;5;
70142;COOPERATIVA MERCADO AGROPECUARIO LAS PALMERAS;;CALLE LAZADA NORTE III Y AVENIDA SUR;26/05/2013;2310;5311;0;313;999;1;CNoA;08;5;
70143;COOPERATIVA MERCADO AGROPECUARIO LA NINA;;CALLE BENITO ANIDO S/N, ENTRE ALBUQUERQUE Y PERDOMO;26/06/2013;2305;5311;0;313;999;1;CNoA;08;5;
70144;COOPERATIVA MERCADO AGROPECUARIO CASA BLANCA;;CALLE FUERTE SAN DIEGO NO. 89 Y CARRETERA EL ASILO, CASA BLANCA;26/06/2013;2305;5311;0;313;999;1;CNoA;08;5;
70146;COOPERATIVA MERCADO AGROPECUARIO RAMON HERNANDEZ CUBILLA;;CALZADA DE DIEZ DE OCTUBRE NO.120, ENTRE ALEJANDRO RAMIREZ Y AGUA DULCE;26/06/2013;2310;5311;0;313;999;1;CNoA;08;5;
70147;COOPERATIVA MERCADO AGROPECUARIO PROYECTO FUTURO;;CALLE PALATINO SIN NÚMERO ESQUINA SAN CARLOS;26/06/2013;2310;5311;0;313;999;1;CNoA;08;5;
70148;COOPERATIVA MERCADO AGROPECUARIO EL SOL;;CALLE COMPOSTELA NO. 609, ENTRE LUZ Y PORVENIR;26/06/2013;2304;5311;0;313;999;1;CNoA;08;5;
70149;COOPERATIVA MERCADO AGROPECUARIO 118 Y 39;;CALLE 118, ESQUINA A 39;26/06/2013;2311;5311;0;313;999;1;CNoA;08;5;
70150;COOPERATIVA MERCADO AGROPECUARIO ZAMORA COCO SOLO;;CALLE 130 ESQUINA A 39;26/06/2013;2311;5311;0;313;999;1;CNoA;08;5;
70151;COOPERATIVA CONSTRUCTORA ATLANTICO;CCA;CALLE PEREZ NO. 420, ENTRE REFORMA Y GUASABACOA, RPTO. LUYANO;26/06/2013;2309;4520;0;126;999;1;CNoA;08;5;
70152;COOPERATIVA MERCADO AGROPECUARIO EL LOGRO;;CALLE ARDAY, ENTRE A Y D, LOCALIDAD EL TRIGAL;26/06/2013;2313;5311;0;313;999;1;CNoA;08;5;
70154;COOPERATIVA MERCADO AGROPECUARIO LA COMPLACIENTE;;CALLE CALZADA DEL WAJAY NO. 1886, ENTRE 188 Y 219, FONTANAR;26/06/2013;2313;5311;0;313;999;1;CNoA;08;5;
70155;COOPERATIVA MERCADO AGROPECUARIO ESCALA;;CALLE SERGIO GONZALEZ Y CLAVEL;26/06/2013;2307;5311;0;313;999;1;CNoA;08;5;
70156;COOPERATIVA MERCADO AGROPECUARIO EL MATANCERO;;CALLE 162C, ENTRE 3RA C Y 3RA B, ZONA 1, ALAMAR;26/06/2013;2306;5311;0;313;999;1;CNoA;08;5;
70157;COOPERATIVA MERCADO AGROPECUARIO FLOR DEL ESTE;;CALLE 16, S/N, ENTRE 2DA Y 4TA, REPARTO GUITERAS;26/06/2013;2306;5311;0;313;999;1;CNoA;08;5;
70158;COOPERATIVA NO AGROPECUARIA ANTONIO MACEO;;AVENIDA 23 ENTRE 20 Y 22;26/06/2013;2403;5311;0;327;999;1;CNoA;08;5;
70159;COOPERATIVA NO AGROPECUARIA MERCADO AGROPECUARIO BATABANO;;AVENIDA 71 ENTRE 68 Y FINAL;26/06/2013;2410;5311;0;327;999;1;CNoA;08;5;
70160;COOPERATIVA NO AGROPECUARIA PINILLO;;CALLE 76 ENTRE 81 Y 91;26/06/2013;2408;5311;0;327;999;1;CNoA;08;5;
70161;COOPERATIVA NO AGROPECUARIA 8 DE MARZO;;CALLE 21 ENTRE 18 Y 20;26/06/2013;2411;5311;0;327;999;1;CNoA;08;5;
70162;COOPERATIVA NO AGROPECUARIA LA CONQUISTADORA;;CALLE 18 ENTRE 7MA Y 9NA;26/06/2013;2404;5311;0;327;999;1;CNoA;08;5;
70163;COOPERATIVA NO AGROPECUARIA NUEVA LINEA;;CALLE 38 ENTRE 31 Y 33;26/06/2013;2405;5311;0;327;999;1;CNoA;08;5;
70164;COOPERATIVA NO AGROPECUARIA LA UNICA;;AVENIDA 37 S/N ENTRE 36 Y 38;26/06/2013;2407;5311;0;327;999;1;CNoA;08;5;
70165;COOPERATIVA NO AGROPECUARIA LOS HERMANOS;;CALLE 12 NO. 2507 ENTRE 25 Y 29;26/06/2013;2406;5311;0;327;999;1;CNoA;08;5;
70166;COOPERATIVA MERCADO AGROPECUARIO 9NA. E I;;CALLE 9NA, ESQUINA A I;27/06/2013;2302;5311;0;313;999;1;CNoA;08;5;
70167;COOPERATIVA MERCADO AGROPECUARIO 26 y 41;;CALLE 26 ENTRE 39 Y 41;27/06/2013;2302;5311;0;313;999;1;CNoA;08;5;
70168;COOPERATIVA MERCADO AGROPECUARIO 25 Y 10;;CALLE 10 ENTRE 25 Y 27;27/06/2013;2302;5311;0;313;999;1;CNoA;08;5;
70169;COOPERATIVA MERCADO AGROPECUARIO CAYO HUESO;;HOSPITAL Y SAN RAFAEL;27/06/2013;2303;5311;0;313;999;1;CNoA;08;5;
70170;COOPERATIVA MERCADO AGROPECUARIO EL ARROYO;;CALLE MERCADO, ENTRE ARROYO Y SANTA MARTA;27/06/2013;2303;5311;0;313;999;1;CNoA;08;5;
70171;COOPERATIVA MERCADO AGROPECUARIO EL MONACO;;CALLE GOSS, ENTRE MAYIA RODRIGUEZ Y AMADO;27/06/2013;2309;5311;0;313;999;1;CNoA;08;5;
70172;COOPERATIVA MERCADO AGROPECUARIO LOS PINOS;;FERNANDEZ DE CASTRO, ENTRE FINLAY Y CISNEROS BETANCOURT, LOCALIDAD LOS PINOS;27/06/2013;2314;5311;0;313;999;1;CNoA;08;5;
70173;COOPERATIVA MERCADO AGROPECUARIO EL ELECTRICO;;CALLE PALLARE S/N, ENTRE CAMILO CIENFUEGOS Y MARTI, LOCALIDAD EL ELECTRICO;27/06/2013;2314;5311;0;313;999;1;CNoA;08;5;
70174;COOPERATIVA MERCADO AGROPECUARIO VENCEREMOS;;CALLE MARIA LUISA ENTRE PEDRO NUEVO Y LIBERTAD, REPARTO FRATERNIDAD;27/06/2013;2314;5311;0;313;999;1;CNoA;08;5;
70175;COOPERATIVA MERCADO AGROPECUARIO 1RA Y D;;CALLE 1RA, ENTRE C Y D, REPARTO POEY;27/06/2013;2314;5311;0;313;999;1;CNoA;08;5;
70176;COOPERATIVA MERCADO AGROPECUARIO MANTILLA;;CALLE CALZADA DE MANAGUA ENTRE 1RA Y 2DA;27/06/2013;2314;5311;0;313;999;1;CNoA;08;5;
70177;COOPERATIVA MERCADO AGROPECUARIO EL TRANVIA;;CALLE MACEO, ESQUINA VERSALLES;27/06/2013;2307;5311;0;313;999;1;CNoA;08;5;
70178;COOPERATIVA CONSTRUCTORA DAMASO;;CALLE SANTA TERESA NO. 309, ENTRE MAZARREDO Y LINDERO, NUEVO VEDADO;27/06/2013;2302;4520;0;126;999;1;CNoA;08;5;
70179;COOPERATIVA MERCADO AGROPECUARIO EL TRIUNFO;;EDIFICIO 320, REPARTO CAMILO CIENFUEGOS;27/06/2013;2306;5311;0;313;999;1;CNoA;08;5;
70180;COOPERATIVA MERCADO AGROPECUARIO LAS AVENIDAS;;CALLE 176 ENTRE 5TA Y 1RA D, ALAMAR;27/06/2013;2306;5311;0;313;999;1;CNoA;08;5;
70181;COOPERATIVA MERCADO AGROPECUARIO LA GRANJITA;;CALLE COLON, ENTRE SAN CRISTOBAL Y CALZADA DEL CERRO;27/06/2013;2310;5311;0;313;999;1;CNoA;08;5;
70182;COOPERATIVA MERCADO AGROPECUARIO AMISTAD Y VIRTUDES;;CALLE VIRTUDES, ESQUINA A AMISTAD;27/06/2013;2303;5311;0;313;999;1;CNoA;08;5;
70183;COOPERATIVA MERCADO AGROPECUARIO LA CORONELA;;CALLE 222-A, ENTRE 23 Y 25, LOCALIDAD LA CORONELA;27/06/2013;2312;5311;0;313;999;1;CNoA;08;5;
70184;COOPERATIVA MERCADO AGROPECUARIO CUATRO CAMINOS;;CALLE 101, ENTRE 100 Y 102, CUATRO CAMINOS;27/06/2013;2315;5311;0;313;999;1;CNoA;08;5;
70185;COOPERATIVA MERCADO AGROPECUARIO TORRIENTES;;CALLE 26-A, ENTRE 63 Y 65, LOCALIDAD TORRIENTES;27/06/2013;2315;5311;0;313;999;1;CNoA;08;5;
70186;COOPERATIVA NO AGROPECUARIA RECICLAJE DE DESECHOS DE ARTEMISA;;CALLE 33 NO. 3402 ENTRE 34 Y 36;27/06/2013;2209;3950;0;102;999;1;CNoA;08;5;
70187;COOPERATIVA MERCADO AGROPECUARIO LOTERIA;;CALLE 44, ENTRE 97 Y 99, REPARTO LOTERIA;28/06/2013;2315;5311;0;313;999;1;CNoA;08;5;
70188;COOPERATIVA DE SERVICIOS DE CONSTRUCCION, MANTENIMIENTO Y MONTAJE;GENEC;CALLE MANUEL GONZALEZ, NO 19527 ENTRE GABRIEL Y PEPE PRIETO, LOCALIDAD ROSALIA;28/06/2013;2308;4520;0;126;999;1;CNoA;08;5;
70189;COOPERATIVA MERCADO AGROPECUARIO LA ESPERANZA;;CALLE PARQUE OESTE ENTRE 10 Y 11, REPARTO EMBIL;28/06/2013;2313;5311;0;313;999;1;CNoA;08;5;
70190;COOPERATIVA MERCADO AGROPECUARIO LA PINA;;CALLE PERFECTO LACOSTE Y MASO;28/06/2013;2310;5311;0;313;999;1;CNoA;08;5;
70191;COOPERATIVA MERCADO AGROPECUARIO SHALOOM;;CALZADA DE GUINES ENTRE MANGO Y ROMANICH;28/06/2013;2308;5311;0;313;999;1;CNoA;08;5;
70192;COOPERATIVA MERCADO AGROPECUARIO LA CAROLINA;;CALZADA DE SAN MIGUEL ENTRE E Y GARRIDO, REPARTO LA CAROLINA;28/06/2013;2308;5311;0;313;999;1;CNoA;08;5;
70193;COOPERATIVA MERCADO AGROPECUARIO SAN JUAN DE LOS PINOS;;CALLE SAN JUAN DE LOS PINOS ENTRE 2DA Y B;28/06/2013;2308;5311;0;313;999;1;CNoA;08;5;
70194;COOPERATIVA MERCADO AGROPECUARIO PLAZA CERRO;;CALLE TULIPÁN SIN NÚMERO, ENTRE CLAVEL Y MARIANO;28/06/2013;2310;5311;0;313;999;1;CNoA;08;5;
70195;COOPERATIVA MERCADO AGROPECUARIO SAN BERNARDINO;;CALLE SAN BERNARDINO, ENTRE DUREGE Y SERRANO;28/06/2013;2309;5311;0;313;999;1;CNoA;08;5;
70196;COOPERATIVA MERCADO AGROPECUARIO LOS BENAVIDES;;CALLE BENAVIDES, ENTRE COMPROMISO Y REGLITA;28/06/2013;2309;5311;0;313;999;1;CNoA;08;5;
70197;COOPERATIVA MERCADO AGROPECUARIO CIELOS ABIERTOS;;332 Y 55, REPARTO CONCEPCION;28/06/2013;2312;5311;0;313;999;1;CNoA;08;5;
70198;COOPERATIVA DE SERVICIOS DE TRANSPORTE DE PASAJEROS;SERVIPAS;CALLE 102 NO.9909, ENTRE 99 Y 101;28/06/2013;2315;6021;0;151;999;1;CNoA;08;5;
70199;COOPERATIVA MERCADO AGROPECUARIO 21 Y TEJAR;;CALLE 21 Y TEJAR, REPARTO VISTA ALEGRE;28/06/2013;2309;5311;0;313;999;1;CNoA;08;5;
70200;COOPERATIVA MERCADO AGROPECUARIO LAGUERUELA;;CALLE LAGUERUELA ENTRE JORGE Y AVELLANEDA;28/06/2013;2309;5311;0;313;999;1;CNoA;08;5;
70201;COOPERATIVA MERCADO AGROPECUARIO EL AFAN;;CALLE 1RA, S/N ENTRE 2DA Y 3RA, REPARTO AFAN.;28/06/2013;2308;5311;0;313;999;1;CNoA;08;5;
70202;COOPERATIVA MERCADO AGROPECUARIO VERSALLES;;CALLE 172, ESQUINA A 41, LOCALIDAD VERSALLES;28/06/2013;2312;5311;0;313;999;1;CNoA;08;5;
70203;COOPERATIVA MERCADO AGROPECUARIO EL CRIOLLO;;CALZADA DE SAN MIGUEL DEL PADRON ESQUINA A HERMANOS AMEJEIRAS, REPARTO DIEZMERO.;28/06/2013;2308;5311;0;313;999;1;CNoA;08;5;
70204;COOPERATIVA MERCADO AGROPECUARIO EL BOSQUE;;AVE. INDEPENDENCIA ENTRE LINEA DEL FERROCARRIL Y 323, RANCHO BOYEROS;28/06/2013;2313;5311;0;313;999;1;CNoA;08;5;
70205;COOPERATIVA MERCADO AGROPECUARIO 11 Y F;;CALLE 11 ENTRE F Y G, LOCALIDAD LAWTON.;28/06/2013;2309;5311;0;313;999;1;CNoA;08;5;
70206;COOPERATIVA MERCADO AGROPECUARIO LA NUEVA JOYA;;CALLE 250, ENTRE 35 Y 37, LOCALIDAD SAN AGUSTIN;28/06/2013;2312;5311;0;313;999;1;CNoA;08;5;
70207;COOPERATIVA MERCADO AGROPECUARIO EL COMPLACIENTE;;VIA BLANCA ENTRE AVENIDA DE GUANABACOA Y CALLE 10, REPARTO CHIVAS;28/06/2013;2307;5311;0;313;999;1;CNoA;08;5;
70208;COOPERATIVA MERCADO AGROPECUARIO LA ALBORADA;;CALLE A, ENTRE 10 Y 100, REPARTO ALTAHABANA;28/06/2013;2313;5311;0;313;999;1;CNoA;08;5;
70209;COOPERATIVA MERCADO AGROPECUARIO LAS PIEDRAS;;CALLE E S/N, ESQUINA A SEPTIMA;28/06/2013;2313;5311;0;313;999;1;CNoA;08;5;
70210;COOPERATIVA LA CUBANA;;CALLE ZAPATA Y CALLE 22;28/06/2013;2302;5040;0;151;999;1;CNoA;08;5;
70211;COOPERATIVA RECONSTRUCTORA DE VEHICULOS;;VIA BLANCA NO. 575, ENTRE PRIMELLES Y PALATINO;28/06/2013;2310;5040;0;151;999;1;CNoA;08;5;
70212;COOPERATIVA MERCADO AGROPECUARIO LA VICTORIA;;AVE. S/N LINEA DEL FERROCARIL;28/06/2013;2313;5311;0;313;999;1;CNoA;08;5;
70213;COOPERATIVA MERCADO AGROPECUARIO LOS HERMANOS;;CALLE 283, ESQUINA A 270, LOCALIDAD WAJAY;28/06/2013;2313;5311;0;313;999;1;CNoA;08;5;
70214;COOPERATIVA TAXI RUTERO 1;CTR 1;MATADERO NO. 116 ENTRE NUEVA DEL PILAR Y FINAL;28/06/2013;2310;6021;0;151;999;1;CNoA;08;5;
70215;COOPERATIVA JUPITER;;AVE. 23 NO. 1218, ENTRE 12 Y 14.;29/06/2013;2302;5040;0;151;999;1;CNoA;08;5;
70216;COOPERATIVA NO AGROPECUARIA DE CONSTRUCCION Y MANTENIMIENTO 50 ANIVERSARIO;;CALLE 124 ENTRE AVE. 65 Y 67 S/N;29/06/2013;2202;4520;0;126;999;1;CNoA;08;5;
70217;COOPERATIVA DE TRANSPORTE DE PASAJEROS ARTEMISA;;CALLE 33 NO. 217 ENTRE 2-A Y 8;29/06/2013;2209;6021;0;151;999;1;CNoA;08;5;
70218;COOPERATIVA TAXI RUTERO 2;CTR 2;CALLE 272, ESQUINA A 27-A, SAN AGUSTIN;29/06/2013;2312;6021;0;151;999;1;CNoA;08;5;
70220;COOPERATIVA DE SERVICIOS DE CONSTRUCCION, TECNICOS-INGENIEROS Y PRODUCCION DE MATERIALES;LA 1RA. DE PLAZA;CALLE 16 NO. 67B, ENTRE LINEA Y 11, LOCALIDAD VEDADO;01/07/2013;2302;4520;0;126;999;1;CNoA;08;5;
70221;COOPERATIVA DE SERVICIOS DE CONSTRUCCION, TECNICOS-INGENIEROS, MATENIMIENTO Y MONTAJE;BUENA VISTA;CALLE VIRTUDES, NO. 676 APTO. 12, ENTRE BELASCOAIN Y GERVASIO;01/07/2013;2303;4520;0;126;999;1;CNoA;08;5;
70222;COOPERATIVA DE SERVICIOS DE CONSTRUCCION, MANTENIMIENTO Y MONTAJE DE PANELERIA LIGERA;7 DE NOVIEMBRE;CALLE 16 NO. 67B, ENTRE LINEA Y 11, LOCALIDAD VEDADO;01/07/2013;2302;4520;0;126;999;1;CNoA;08;5;
70223;COOPERATIVA NOVEDADES;;CALLE MAYIA RODRIGUEZ Y SANTA CATALINA;01/07/2013;2309;5040;0;313;999;1;CNoA;08;5;
70224;COOPERATIVA LA COMPLACIENTE;;CALLE 26 ENTRE 29 Y 31;01/07/2013;2302;5040;0;313;999;1;CNoA;08;5;
70225;COOPERATIVA DE PRODUCCION DE CERAMICA UTILITARIA Y DECORATIVA DEL MUNICIPIO DE HABANA DEL ESTE;;CALLE SAN LUIS NO. 4, ENTRE SAN MIGUEL Y SAN DIONISIO, LOCALIDAD CELIMAR;10/09/2013;2306;3091;0;102;999;1;CNoA;08;5;
70226;COOPERATIVA CARPINTERIA DECORATIVA;;CALLE 139B, EDIF. 14205, APTO. F, ENTRE 142 Y 146, REPARTO REYNOLD GARCIA;13/09/2013;2501;3910;0;102;999;1;CNoA;08;5;
70227;DECORARTE;;CALLE 36 EDIF. ISABO, APTO. 40, ENTRE 1RA Y AUTOPISTA, VARADERO.;13/09/2013;2502;2421;0;102;999;1;CNoA;08;5;
70228;COOPERATIVA KARABALI;;CALLE 23 NO. 155 ENTRE N Y O, VEDADO.;17/09/2013;2302;5610;0;313;999;1;CNoA;08;5;
70229;COOPERATIVA NO AGROPECUARIA DE CLAVOS PARA HERRAR LOS JIMENEZ;;CALLE 4 DEL SUR NO. 24 ENTRE PASEO MARTI Y 1 DEL ESTE;17/09/2013;2608;3399;0;102;999;1;CNoA;08;5;
70230;MERCADO AGROPECUARIO ESTATAL JUAN DELGADO;;CALLE 6 ESQUINA A 9.;18/09/2013;2401;5311;0;327;999;1;CNoA;08;5;
70231;COOPERATIVA VINOS FAMILIARES DIVINNO;;CALLE ARMENTEROS, NO. 30 M, ENTRE CALZADA DE LUYANO Y LINEA DEL FERROCARRIL.;19/09/2013;2309;1702;0;111;999;1;CNoA;08;5;
70232;COOPERATIVA ORNITOLOGICA DE CUBA VILLA CLARA;;CALLE NAZARENO S/N, ENTRE CARRETERA CENTRAL Y CICLON;19/09/2013;2609;5335;0;131;999;1;CNoA;08;5;
70233;COOPERATIVA ORNITOLOGICA DE CUBA, MATANZAS.;;CALLE 83, NO. 29005, ENTRE 290 Y 292.;20/09/2013;2501;5335;0;131;999;1;CNoA;08;5;
70234;COOPERATIVA TROPICAL 12 Y 21;;CALLE 21 NO. 502 ESQUINA A CALLE 12;23/09/2013;2302;5610;0;313;999;1;CNoA;08;5;
70235;TALLER DE ELECTRONICA HERMANOS CRUZ;;CALLE F, FINAL 12 PLANTAS ENTRE C Y 5TA, REPARTO HERMANOS CRUZ;23/09/2013;2108;5360;0;311;999;1;CNoA;08;5;
70236;COOPERATIVA DE PRIMER GRADO DE RECICLAJES DE DESECHOS DE ESMERALDA;CONARES;CALLE SALVADOR ALLENDE NO.28 ENTRE JOAQUIN DE AGUERO Y PEDRO QUESADA;24/09/2013;3002;3950;0;102;999;1;CNoA;08;5;
70238;COOPERATIVA LAVATIN OK;;CALLE 23 NO. 953-A, ENTRE 2 Y 4, LOCALIDAD VEDADO.;24/09/2013;2302;9901;0;313;999;1;CNoA;08;5;
70239;ATELIER LA MODA SAN LUIS;;CALLE JUANA ROMERO, NO. 82, ENTRE IGNACIO AGRAMONTE Y EMILIO NUÑEZ.;24/09/2013;2109;2010;0;311;999;1;CNoA;08;5;
70240;COOPERATIVA OKINAWA;;CALLE SAN MIGUEL NO. 101 ENTRE INDUSTRIA Y AMISTAD;25/09/2013;2303;5610;0;313;999;1;CNoA;08;5;
70241;COOPERATIVA ORNITOLOGICA DE CUBA SANCTI-SPIRITUS;;CIRCUNVALACION ESQUINA CARLOS ROLOFF;25/09/2013;2807;5335;0;131;999;1;CNoA;08;5;
70242;COOPERATIVA DE PRIMER GRADO DE PRODUCCION DE CONFECCIONES TEXTILES DEL MUNICIPO MARIANAO;;CALLE 132 NO. 5707 ENTRE 57 Y 61;25/09/2013;2311;2010;0;102;999;1;CNoA;08;5;
70243;COOPERATIVA ORNITOLOGICA DE CUBA COC LA HABANA;;CALLE INFANTA NO. 410 ENTRE SAN RAFAEL Y SAN MIGUEL;25/09/2013;2303;5335;0;131;999;1;CNoA;08;5;
70244;COOPERATIVA DE CONSTRUCCION PIRAMIDE;PIRAMIDE;CALLE 9NA. S/N ENTRE 10 Y 11, SANTA MARIA LOMA;25/09/2013;2306;4520;0;126;999;1;CNoA;08;5;
70245;COOPERATIVA DE CONSTRUCCION ARQDECONS;ARQDECONS;CALLE 44 NO. 4116, ENTRE 38 Y 41.;25/09/2013;2301;4520;0;126;999;1;CNoA;08;5;
70246;COOPERATIVA ORNITOLOGICA DE CUBA GRANMA;;CALLE DONATO MARMOL, NO.157, ENTRE CANDUCHA FIGUEREDO Y PARADA, LOCALIDAD SAN JUAN;26/09/2013;3304;5335;0;131;999;1;CNoA;08;5;
70247;COOPERATIVA DE PRODUCCION Y REPARACION DE CALZADO Y ARTICULOS DE TALABARTERIA DEL MUNICIPIO LA LISA;;AVE. 63 A NO. 20808, ENTRE 208 Y 212;26/09/2013;2312;2120;0;102;999;1;CNoA;08;5;
70248;COOPERATIVA CONFECCIONES OPINA;;CALLE REINA NUMEROS 465-467 BAJOS, ENTRE GERVASIO Y BELASCOAIN;26/09/2013;2303;2010;0;313;999;1;CNoA;08;5;
70249;RESTAURANT CIELO AZUL COOPERATIVA;;CALLE REAL, NO. 10, ENTRE LOS CAMINOS A LOS POBLADOS CUBA NUEVA Y LAS OVAS.;26/09/2013;2108;5610;0;311;999;1;CNoA;08;5;
70250;CONFECCIONES MODEL;;CALLE SAN RAFAEL NUMEROS 613 Y 615, ENTRE GERVASIO Y BELASCOAIN;26/09/2013;2303;2010;0;313;999;1;CNoA;08;5;
70251;COOPERATIVA ORNITOLOGICA DE CUBA, SANTIAGO DE CUBA;;CALLE ENRAMADA, NO. 512, ENTRE RELOJ Y SAN AGUSTIN;26/09/2013;3406;5335;0;131;999;1;CNoA;08;5;
70252;COOPERATIVA ORNITOLOGICA DE CUBA IMPORTADORA EXPORTADORA;COCIMPEX;CALLE VICTORIA NO. 11609 ENTRE AMERICA Y FLORIDA, REPARTO MARTI;27/09/2013;2310;5120;0;131;999;1;CNoA;08;5;
70253;COOPERATIVA DE CONSTRUCCION COREMA;COREMA;AVENIDA DE LOS APOSTOLES NO. 132, ENTRE NARANJITO Y A, REPARTO LOS PINOS.;27/09/2013;2314;4520;0;126;999;1;CNoA;08;5;
70254;COOPERATIVA DE CONSTRUCCION 5 DE DICIEMBRE, COSIC;;CALLE NOVENA, S/N, ENTRE 160 A Y 160 E, ZONA 11, LOCALIDAD ALAMAR;27/09/2013;2306;4520;0;126;999;1;CNoA;08;5;
70255;COOPERATIVA TALLER POLI SERVICIOS GERONA;;CALLE 35, ENTRE 22 Y 24, NUEVA GERONA;27/09/2013;4001;5360;0;325;999;1;CNoA;08;5;
70256;COOPERATIVA INDUSTRIAS PURITA;;CALLEJÓN DOLORES ENTRE 1 Y FINAL, REPARTO DOLORES;30/09/2013;2308;1549;0;111;999;1;CNoA;08;5;
70257;ORNITOLOGICA DE CUBA PINAR DEL RIO;;CALLE GERARDO MEDINA NO. 52 ENTRE ADELA AZCUY E ISIDRO DE ARMAS;30/09/2013;2108;5335;0;131;999;1;CNoA;08;5;
70258;CLAVEL COOPERATIVA;;CALLE FRANK PAIS, NO. 244, ENTRE LA AVENIDA RAFAEL FERRO Y LA CALLE B, REPARTO CINCO DE SEPTIEMBRE;30/09/2013;2108;5610;0;311;999;1;CNoA;08;5;
70259;TALLER DE REPARACION DE CALZADO ESTRELLA ROJA;;CALLE MAXIMO GOMEZ, NO. 60, ENTRE ISABEL RUBIO Y COLON;30/09/2013;2108;5360;0;311;999;1;CNoA;08;5;
70260;COOPERATIVA DE INSTITUTO DE SALUD Y BELLEZA BELLA II;;CALLE CALZADA NO. 709 ENTRE PASEO Y A;30/09/2013;2302;9902;0;313;999;1;CNoA;08;5;
70261;COOPERATIVA ORNITOLOGICA DE CUBA ARTEMISA;;CALLE 86 NO. 8508 ENTRE 85 Y 87;30/09/2013;2207;5335;0;131;999;1;CNoA;08;5;
70262;COOPERATIVA DE MONTAJE, MANTENIMIENTO Y REPARACION DE EQUIPOS DE PESAJE;;CALLE 76 NO. 2131, ENTRE 21 Y 23;30/09/2013;2301;3712;0;102;999;1;CNoA;08;5;
70263;COOPERATIVA ORNITOLOGICA DE CUBA, CAMAGUEY;;AVE. AMALIA SIMONI S/N, ENTRE GENERAL GOMEZ Y PROLONGACION DE PADRE VALENCIA;30/09/2013;3008;5335;0;131;999;1;CNoA;08;5;
70264;COOPERATIVA ORNITOLOGICA DE CUBA CIENFUEGOS;;AVE. 52 NO. 3307 ENTRE 33 Y 35.;30/09/2013;2707;5335;0;131;999;1;CNoA;08;5;
70265;EL MILLAR;;CALLE 33 NO. 4007 ANTRE 40 Y 42;01/10/2013;2209;5610;0;326;999;1;CNoA;08;5;
70266;COOPERATIVA ORNITOLOGICA DE CUBA CIEGO DE AVILA;COC CIEGO DE AVILA;CALLE CHICHO TORRES NO. 71, ENTRE MACEO Y HONORATO DEL CASTILLO;02/10/2013;2908;5335;0;131;999;1;CNoA;08;5;
70267;COOPERATIVA ORNITOLOGICA DE CUBA HOLGUIN;;CALLE MARTINES NO. 156 ENTRE ARICOCHEA Y LUZ CABALLERO;02/10/2013;3206;5335;0;131;999;1;CNoA;08;5;
70268;COOPERATIVA ORNITOLOGICA DE CUBA, MAYABEQUE;COC MAYABEQUE;AVE. 81 NO. 9414, ENTRE 94 Y 98;02/10/2013;2408;5335;0;131;999;1;CNoA;08;5;
70269;COOPERATIVA NO AGROPECUARIA KASTLE;;CALLE MARINO, NO. 853, ENTRE TALLERES Y SANTA ANA;03/10/2013;2302;3940;0;242;999;1;CNoA;08;5;
70270;COOPERATIVA DE SERVICIOS TECNICOS DEL MUNICIPIO DIEZ DE OCTUBRE;;CALLE SANTOS SUAREZ NO. 65 ESQUINA A RABI;03/10/2013;2309;3426;0;102;999;1;CNoA;08;5;
70271;COOPERATIVA NO AGROPECUARIA DE PRODUCCION Y RESTAURACION DE MUEBLES  E INMUEBLES;;CALLE JOAQUIN PEREZ, NO. 9-A, ENTRE CAMILO CIENFUEGOS Y RAFAEL TREJO;03/10/2013;2104;3910;0;311;999;1;CNoA;08;5;
70272;COOPERATIVA DE CONSTRUCCION DECONST;DECONST;VIA RÁPIDA E/ LAS CALLES 11 Y 12, OFICINA 14, LOCALIDAD SANTA MARTA;03/10/2013;2502;4520;0;126;999;1;CNoA;08;5;
70273;COOPERATIVA ORNITOLOGICA DE CUBA ISLA DE LA JUVENTUD;;CALLE 45, S/N, ENTRE 50 Y 52, REPARTO 26 DE JULIO, NUEVA GERONA;04/10/2013;4001;5335;0;131;999;1;CNoA;08;5;
70274;COOPERATIVA INSTITUTO DE BELLEZA LA ELEGANCIA;;CALLE INDEPENDENCIA, BULEVAR, S/N ENTRE MACEO Y SIMON REYES;04/10/2013;2908;9902;0;318;999;1;CNoA;08;5;
70275;COOPERATIVA CIRCULO SOCIAL EL ASIENTO;;COMUNIDAD EL ASIENTO.;04/10/2013;2901;5610;0;318;999;1;CNoA;08;5;
70276;COOPERATIVA NO AGROPECUARIA DE PRIMER GRADO COMBINADO INDUSTRIAL PINAR DEL RIO;;EL CONSTRUCTOR NO. 72 CALLEJON SAN MATEO E ISABEL RUBIO, ZONA INDUSTRIAL SIETE MATAS;07/10/2013;2108;3910;0;311;999;1;CNoA;08;5;
70277;COOPERATIVA NO AGROPECUARIA DE PRODUCCION Y SERVICIOS FRANCISCO HERNANDEZ MACURAN;;CALLE LUCRECIO ACANDA S/N, LAS MARTINAS;07/10/2013;2101;3910;0;311;999;1;CNoA;08;5;
70278;COOPERATIVA DE PRIMER GRADO DE PRODUCCION Y REPARACION DE MUEBLES DEL MUNICIPIO GUINES;;AVE. 85 NO. 12411 ENTRE 77 Y 124;09/10/2013;2408;3910;0;102;999;1;CNoA;08;5;
70279;COOPERATIVA DE CONSTRUCCION TIEMPOS NUEVOS;;CALLE BEMBETA NO. 718 ENTRE PADRE VALENCIA Y GENERAL GOMEZ;11/10/2013;3008;4520;0;126;999;1;CNoA;08;5;
70280;COOPERATIVA ORNITOLOGICA DE CUBA, LAS TUNAS;;CALLE FRANCISCO VARONA NO. 339 ENTRE LUCAS ORTIZ Y LICO CRUZ;11/10/2013;3105;5335;0;131;999;1;CNoA;08;5;
70281;COOPERATIVA DE CONSTRUCCION SAGEBIEN;;CALLE 292, NÚMERO 9303, ENTRE CALLE 97 Y CALLE 93;14/10/2013;2501;4520;0;126;999;1;CNoA;08;5;
70282;COOPERATIVA ORNITOLOGICA DE CUBA GUANTANAMO;;CALLE LOS MACEO NO. 1074, ENTRE DONATO MARMOL Y BERNABE VARONA;14/10/2013;3509;5335;0;131;999;1;CNoA;08;5;
70283;COOPERATIVA DE CONSTRUCCION 28 DE ENERO;;CALLE COLÓN NÚMERO 1752 ENTRE RAMBLA Y VICTORIA, REPARTO MARTÍ;15/10/2013;2310;4520;0;126;999;1;CNoA;08;5;
70284;COOPERATIVA DE CONSTRUCCION, ANDAMIOS Y COFRES;SANCOF;CALLE 192 NO. 15302, APTO. 2 ENTRE 151 Y 155, PISO 2, REPARTO IGLESIAS;25/10/2013;2501;4520;0;126;999;1;CNoA;08;5;
70285;COOPERATIVA DE CONSTRUCCION VERANES;;CALLE 6 NO. 359 INTERIOR, ENTRE LAS CALLES 13 Y 15, REPARTO VISTA ALEGRE;18/11/2013;3406;4520;0;126;999;1;CNoA;08;5;
70286;LA CONCORDIA;;CALLE 155 NO. 4 ENTRE 190 Y 192, REPARTO IGLESIAS;06/12/2013;2501;4520;0;126;999;1;CNoA;08;5;
70287;COOPERATIVA DE CONSTRUCCION SACHA & M;;CALLE PLACIDO NO. 24, ENTRE AUGUSTO GUARDIOLA Y CANDIDO CALDERON;06/12/2013;2807;4520;0;126;999;1;CNoA;08;5;
70288;COOPERATIVA DE CONSTRUCCION INGENIERIA EXTREMA;;CALLE PASTORA, NO. 2901 ENTRE REFORMA Y ZAMBRANA, LOCALIDAD ANTONIO MACEO;09/12/2013;2310;4520;0;126;999;1;CNoA;08;5;
70289;COOPERATIVA DE CONSTRUCCION A CORAZON LIMPIO;COMIXVAR;VÍA RÁPIDA SIN NÚMERO ENTRE CALLE 11 Y CALLE 12, SANTA MARTHA;10/12/2013;2502;4520;0;126;999;1;CNoA;08;5;
