06642;INSTITUTO DE INVESTIGACIONES AGROPECUARIAS JORGE DIMITROV;;CARRETERA DE BAYAMO A MANZANILLO KM 16 1/2;31/01/1978;3304;8010;0;211;999;2;UP;07;0;00211
06644;EMPRESA DE TECNOLOGIA MEDICA DIGITAL;ICID;CALLE 202 NO. 1704 E/ 17 Y 19, SIBONEY;28/02/1978;2301;8010;0;692;692;1;EMP;02;0;14385
06647;INSTITUTO NACIONAL DE SALUD DE LOS TRABAJADORES;;CALZADA DE BEJUCAL KM. 7 1/2;31/08/1978;2314;8010;0;241;999;2;UP;05;0;00241
06652;INSTITUTO DE MEDICINA TROPICAL PEDRO KOURI;;AUTOPISTA DEL MEDIODIA NO. 251 KM. 6 E/ CARRETERA CENTRAL Y AUTOPISTA;31/01/1977;2312;8010;0;241;999;2;UP;05;0;00241
06657;CENTRO DE ESTUDIO SOBRE EUROPA OCIDENTAL, AFRICA Y MEDIO ORIENTE;;CALLE 3RA. NO. 1805 E/ 18 Y 20, MIRAMAR;31/12/1979;2301;8120;0;501;999;2;UP;05;0;
06661;INSTITUTO DE INVESTIGACIONES DE VIANDAS TROPICALES;;FINCA TRES CAROLINAS, BARRIO RIO;31/08/1981;2611;8010;0;131;741;2;UP;07;0;14536
06668;CENTRO NACIONAL PARA LA PRODUCCION DE ANIMALES DE LABORATORIO;CENPALAB;CALLE 3RA, NO. 40759, ENTRE 6TA. Y CARRETERA DE TIRABEQUE, REPARTO LA UNION, CONSEJO POPULAR NUEVO SANTIAGO;31/10/1983;2313;0315;0;692;692;1;EMP;02;0;14385
06670;INSTITUTO DE FILOSOFIA;;CALZADA NO. 251 ESQ. J;31/03/1985;2302;8120;0;211;999;2;UP;05;0;00211
06673;CENTRO NACIONAL DE BIOPREPARADOS;BIOPREPARADOS;CARRETERA BELTRAN, KM. 1 1/2;31/08/1985;2401;8010;0;692;692;1;EMP;02;0;14385
06675;CENTRO DE INGENIERIA GENETICA Y BIOTECNOLOGIA;;AVENIDA 31 S/N, E/ 158 Y 190;30/06/1986;2301;8010;0;692;692;1;EMP;02;0;14385
06676;CENTRO DE INMUNOENSAYO;INMUNO ENSAYO;CALLE 134 ESQUINA A AVENIDA 25, REPARTO CUBANACAN;30/06/1986;2301;8010;0;692;692;1;EMP;02;0;14385
06678;INSTITUTO DE CIBERNETICA, MATEMATICA Y FISICA;ICIMAF;CALLE 15 NO. 551 E/ C Y D;28/03/1977;2302;8010;0;211;648;2;UP;07;0;12526
06679;INSTITUTO DE ECOLOGIA Y SISTEMATICA;;CARRETERA DE VARONA KM 3 1/2 (ANTIGUA FINCA LA CHATA;31/10/1986;2313;8010;0;211;650;2;UP;07;0;11801
06680;CENTRO DE INVESTIGACIONES DE ENERGIA SOLAR;;CARRETERA SIBONEY KM 5 1/2, REP. A. SANTAMARIA;31/10/1986;3406;8010;0;211;999;2;UP;07;0;00211
06681;CENTRO DE INVESTIGACIONES DEL NIQUEL CAPITAN ALBERTO FERNANDEZ MONTES DE OCA;CEDINIQ;CARRETERA YAGRUMAJE, KM 7;31/12/1986;3214;8010;1;104;618;2;UP;07;0;02590
06682;CENTRO DE INVESTIGACION DEL PETROLEO;CEINPET;CHURRUCA NO. 481, ENTRE VIA BLANCA Y WASHINGTON.;31/12/1986;2310;8010;1;104;614;2;UP;07;0;02605
06684;CENTRO INTEGRADO DE TECNOLOGIAS DEL AGUA;CITA;CIRCUNVALACION NORTE KILOMETRO 4 Y MEDIO;30/11/1987;3008;8010;0;113;013;2;UP;05;0;00113
06685;JARDIN BOTANICO NACIONAL;;CARRETERA DEL ROCIO KM 3 1/2 CALABAZAR;30/11/1987;2313;9433;0;223;999;2;UP;07;0;06816
06686;DELEGACION PROVINCIAL DEL MINISTERIO DE LA AGRICULTURA DE LA HABANA;;AVENIDA INDEPENDENCIA ENTRE VARONA Y ENTRONQUE DE LA CUJAE;31/01/1996;2313;7513;0;131;999;2;UP;05;0;00131
06687;CENTRO INTERNACIONAL DE RESTAURACION NEUROLOGICA;;AVE. 25 NO. 15805 E/ 158 Y 160, CUBANACAN;31/08/1988;2301;8010;0;241;999;2;UP;07;0;00241
06689;UNIDAD DE EXTENSION, INVESTIGACION Y CAPACITACION AGROPECUARIA HOLGUIN;UEICA-H;BARRIO: LA DIVISION, CONSEJO POPULAR VELAZCO;31/12/1989;3201;8010;0;131;741;2;UP;07;0;14536
06690;UNIDAD PRESUPUESTADA DE SERVICIOS DEL MINISTERIO DE CIENCIA, TECNOLOGIA Y MEDIO AMBIENTE EN CIENFUEGOS;;AVE 2 ESQ. A CALLE 35, RPTO PUNTA GORDA;31/07/1990;2707;7514;0;211;999;2;UP;05;0;00211
06691;ASEGURAMIENTO Y LOGISTICA DE CIEGO DE AVILA;;CALLE JOAQUIN AGUERO NO. 120, ENTRE MACEO Y SIMON REYES;31/07/1990;2908;7514;0;211;999;2;UP;05;0;00211
06692;ASEGURAMIENTO Y LOGISTICA DE LAS TUNAS;;LUCAS ORTIZ NO. 163 E/ FCO VEGA Y JULIAN SANTANA;31/07/1990;3105;7514;0;211;999;2;UP;05;0;00211
06693;CENTRO DE INVESTIGACION Y DESARROLLO DE LA INDUSTRIA LIGERA;;CARRETERA VARONA ESQUINA TRES PALMAS, NO. 16801, CAPDEVILA;31/10/1990;2313;8010;0;102;694;2;UP;07;0;14388
06694;CENTRO DE INMUNOLOGIA MOLECULAR;CIM;CALLE 216 ESQUINA A 15, REPARTO ATABEY;31/01/1991;2301;8010;0;692;692;1;EMP;02;0;14385
06696;CENTRO NACIONAL COORDINADOR DE ENSAYOS CLINICOS;;CALLE A NO. 6020 (SEGUNDO PISO) ENTRE 60 Y 62 REPARTO MIRAMAR;31/01/1992;2301;8010;0;241;999;2;UP;07;0;00241
06699;ASEGURAMIENTO Y LOGISTICA DE SANCTI SPIRITUS;;BARTOLOME MASO NO 2 E/ AVENIDA DE LOS MARTIRES E ISABEL MARIA DE VALDIVIA;31/12/1993;2807;7514;0;211;999;2;UP;05;0;00211
06700;UNIDAD PRESUPUESTADA DE SERVICIOS DEL MINISTERIO DE CIENCIA, TECNOLOGIA Y MEDIO AMBIENTE EN GRANMA;;CARRETERA CENTRAL KM 3 1/2, VIA SANTIAGO DE CUBA, RPTO VIVIENDAS CAMPESINAS;31/12/1993;3304;7514;0;211;999;2;UP;05;0;00211
06702;CENTRO DE INGENIERIA E INVESTIGACIONES QUIMICAS;CIIQ;VIA BLANCA E/ INFANTA Y PALATINO;31/01/1977;2310;8010;1;102;733;2;UP;07;0;12968
06704;CENTRO DE INVESTIGACIONES METALURGICAS;CIME;AVE. 51 NO. 23611 E/ 240 Y 236;31/01/1977;2312;8010;0;102;693;1;EMP;02;0;14387
06707;CENTRO DE INVESTIGACIONES PARA LA INDUSTRIA MINERO METALURGICA;CIPIMM;CARRETERA VARONA NO. 12028 KM 1 1/2, CAPDEVILA;31/01/1977;2313;8010;0;104;612;1;EMP;02;0;02377
06710;INSTITUTO CUBANO DE INVESTIGACIONES DE LOS DERIVADOS DE LA CANA DE AZUCAR;ICIDCA;VIA BLANCA NO.804 ESQ. CARRETERA CENTRAL;31/01/1977;2308;8010;0;658;658;1;EMP;02;0;14249
06711;EMPRESA DE CONSTRUCCION Y SERVICIOS DE INGENIERIA;;VIA BLANCA NO. 15 ENTRE CALZADA DE 10 DE OCTUBRE Y RABI;30/11/1995;2309;4520;1;102;694;1;EMP;02;0;14388
06712;INSTITUTO DE INVESTIGACION Y DESARROLLO DE LAS TELECOMUNICACIONES;LACETEL;AVE. INDEPENDENCIA KM 14 1/2, REPARTO PRIMERO DE MAYO;31/10/1978;2313;8010;0;161;999;2;UP;05;0;00161
06714;INSTITUTO DE CARDIOLOGIA Y CIRUGIA CARDIOVASCULAR;;CALLE 17 NO. 703 ESQ. A;31/01/1977;2302;9011;0;241;999;2;UP;05;0;00241
06715;INSTITUTO DE ONCOLOGIA Y RADIOBIOLOGIA;;CALLE 29 ESQ. F;31/01/1977;2302;9011;0;241;999;2;UP;05;0;00241
06716;INSTITUTO DE NEUROLOGIA Y NEUROCIRUGIA;;CALLE 29 S/N ESQ. D;31/01/1977;2302;9011;0;241;999;2;UP;05;0;00241
06717;INSTITUTO DE GASTROENTEROLOGIA;;CALLE 25 NO. 503 E/ H E I;31/01/1977;2302;9011;0;241;999;2;UP;05;0;00241
06718;INSTITUTO DE ENDOCRINOLOGIA;;ZAPATA Y D;31/01/1977;2302;9011;0;241;999;2;UP;05;0;00241
06719;INSTITUTO NACIONAL DE HIGIENE, EPIDEMIOLOGIA Y MICROBIOLOGIA;;INFANTA NO. 1158 E/ LLINAS Y CLAVEL;31/01/1977;2303;9019;0;241;999;2;UP;05;0;00241
06720;CENTRO DE INVESTIGACION Y DESARROLLO DE MEDICAMENTOS;CIDEM;AVE 26 NO. 1605 E/ PUENTES GRANDES E INDEPENDENCIA;31/12/1994;2302;8010;0;692;692;1;EMP;02;0;14385
06721;INSTITUTO NACIONAL DE ANGIOLOGIA Y CIRUGIA VASCULAR;INACV;CALZADA DEL CERRO NO. 1551 ESQ. A DOMINGUEZ;31/01/1977;2310;9011;0;241;999;2;UP;05;0;00241
06722;INSTITUTO DE NEFROLOGIA;;AVE. 26 Y RANCHO BOYEROS;31/01/1977;2302;9011;0;241;999;2;UP;05;0;00241
06723;INSTITUTO DE MEDICINA DEPORTIVA;;CALLE 100 Y PERLA LOS PINOS;31/01/1977;2313;9012;0;242;999;2;UP;05;0;
06724;INSTITUTO DE HEMATOLOGIA E INMUNOLOGIA;;CALZADA DE ALDABO Y CALLE E, RPTO. ALTAHABANA;31/01/1977;2313;8010;0;241;999;2;UP;05;0;00241
06726;CENTRO NACIONAL DE INFORMACION DE CIENCIAS MEDICAS;;CALLE 27, NO. 110, E/ M Y N, VEDADO;31/01/1977;2302;9431;0;241;999;2;UP;05;0;00241
06729;INSTITUTO NACIONAL DE INVESTIGACIONES EN METROLOGIA;INIMET;CONSULADO NO. 206 E/ ANIMAS Y TROCADERO;31/01/1977;2303;8010;0;211;999;2;UP;07;0;06127
06730;CENTRO DE GESTION Y DESARROLLO DE LA CALIDAD;CGDC;REINA NO. 412 E/ GERVASIO Y ESCOBAR;31/01/1977;2303;8010;0;211;999;2;UP;07;0;06127
06732;CENTRO DE INVESTIGACIONES PESQUERAS;CIP;CALLE 246 NO. 503 ENTRE 5TA AVENIDA Y MAR, REPARTO BARLOVENTO.;31/01/1977;2301;8010;0;111;999;2;UP;05;0;00111
06734;CENTRO DE INVESTIGACION Y DESARROLLO DE LA CONSTRUCCION;;CALLE LINEA NO. 810 Y CARRETERA CASA BLANCA, CONSEJO POPULAR CASA BLANCA;31/01/1977;2305;8010;0;126;880;1;EMP;02;0;12191
06737;INSTITUTO DE INVESTIGACIONES PARA LA INDUSTRIA ALIMENTICIA;;CARRETERA GUATAO KM. 3 1/2 Y CALLE 344 (ACCESO AL IIIA), PUNTA BRAVA;31/01/1977;2312;8010;0;111;999;2;UP;07;0;00111
06739;INSTITUTO DE HISTORIA DE CUBA;;AMISTAD NO. 510 E/ REINA Y ESTRELLA;31/01/1977;2303;8120;0;501;999;2;UP;05;0;
06740;INSTITUTO DE GEOFISICA Y ASTRONOMIA;;CALLE 212 NO 2906 E/ AVENIDA 29 Y 31, REPARTO LA CORONELA;31/01/1977;2312;8010;0;211;650;2;UP;07;0;11801
06742;INSTITUTO DE INVESTIGACIONES FUNDAMENTALES EN AGRICULTURA TROPICAL ALEJANDRO DE HUMBOLDT;;CALLE 188, NO. 38754 ENTRE 397 Y LINDEROS, RPTO. SANTIAGO DE LAS VEGAS;31/01/1977;2313;8010;0;131;741;2;UP;07;0;14536
06743;INSTITUTO DE INVESTIGACIONES DE LA CANA DE AZUCAR;INICA;KM 1 1/2 CARRETERA A LA CUJAE;31/01/1977;2313;8010;0;658;658;1;EMP;02;0;14249
06745;INSTITUTO DE GEOLOGIA Y PALEONTOLOGIA;;VIA BLANCA S/N E/ LINEA DEL FERROCARRIL Y CARRETERA CENTRAL;31/01/1977;2308;8010;0;104;999;2;UP;05;0;00104
06746;CENTRO DE APLICACIONES TECNOLOGICAS Y DESARROLLO NUCLEAR;CEADEN;CALLE 30 NO 502 E/ 5TA AVE. Y 7MA.;31/01/1977;2301;8010;0;211;648;2;UP;07;0;12526
06747;INSTITUTO DE SUELOS;;CARRETERA VENTO KM.8 1/2 CAPDEVILA;31/01/1977;2313;8010;0;131;999;2;UP;07;0;00131
06749;INSTITUTO DE METEOROLOGIA;;LOMA DE CASABLANCA;31/01/1977;2305;8010;0;211;650;2;UP;07;0;11801
06751;CENTRO DE INVESTIGACIONES PARA EL MEJORAMIENTO ANIMAL DE LA GANADERIA TROPICAL;CIMAGT;AVENIDA NO. 101 # 6214 ENTRE 100 Y 62, REPARTO LOMA DE TIERRA, CONSEJO POPULAR # 6;31/01/1977;2315;8010;0;131;699;2;UP;07;0;14508
06752;INSTITUTO DE INVESTIGACIONES AVICOLAS;;AVE. 7 DE DICIEMBRE, ROTONDA DEL CACAHUAL, SANTIAGO DE LAS VEGAS;31/01/1977;2313;8010;0;131;699;2;UP;07;0;14508
06753;INSTITUTO DE INVESTIGACIONES PORCINAS;;KM 1 CARRETERA GUATAO, PUNTA BRAVA;31/01/1977;2312;8010;1;131;699;2;UP;07;0;14508
06756;INSTITUTO DE INVESTIGACIONES DE SANIDAD VEGETAL;;CALLE 110 NO. 514 E/ 5TA.B Y 5TA.F;31/01/1977;2301;8010;0;131;999;2;UP;07;0;00131
06759;INSTITUTO DE GEOGRAFIA TROPICAL;;CALLE 13 ESQ. A F;31/01/1977;2302;8010;0;211;650;2;UP;07;0;11801
06761;INSTITUTO DE INFORMACION CIENTIFICA Y TECNOLOGICA;IDICT;CALLE 18 A, ENTRE 41 Y 47, REPARTO MIRAMAR;31/01/1977;2301;9431;0;211;999;2;UP;07;0;00211
06765;INSTITUTO CUBANO DE ANTROPOLOGIA;;CALLE AMARGURA NRO. 203 ENTRE HABANA Y AGUIAR;31/01/1977;2304;8120;0;211;999;2;UP;05;0;
06784;CENTRO NACIONAL DE INVESTIGACIONES CIENTIFICAS;CNIC;AVE. 25 NO. 15202 ESQ.A 158, CUBANACAN;31/01/1977;2301;8010;0;692;692;1;EMP;02;0;14385
06785;INSTITUTO DE CIENCIA ANIMAL;ICA;CARRETERA CENTRAL KM 47;31/01/1977;2402;8010;0;223;999;2;UP;07;0;00223
06786;INSTITUTO NACIONAL DE CIENCIAS AGRICOLAS;INCA;CARRETERA DE TAPASTE KM 3 1/2;31/01/1977;2402;8010;0;223;999;2;UP;07;0;00223
06787;ESTACION EXPERIMENTAL DE PASTOS Y FORRAJE INDIO HATUEY;EEPFIH;CENTRAL ESPANA REPUBLICANA, PERICO;31/01/1977;2505;8010;0;223;999;2;UP;07;0;06818
06788;CENTRO NACIONAL DE SANIDAD AGROPECUARIA;CENSA;CARRETERA DE TAPASTE Y AUTOPISTA NACIONAL;31/01/1977;2402;8010;0;223;999;2;UP;07;0;00223
06791;INSTITUTO DE REFRIGERACION Y CLIMATIZACION;IRC;CALLE 31 NO. 19813 E/ 198 Y 208, LA CORONELA;31/01/1977;2312;8010;0;102;839;1;EMP;02;0;11407
06794;CENTRO DE ISOTOPOS;CENTIS;AVENIDA MONUMENTAL Y CARRETERA LA RADA KM 3 1/2;31/12/1988;2402;8010;0;211;648;2;UP;07;0;12526
06797;UNIDAD PRESUPUESTADA DE SERVICIOS DEL MINISTERIO DE CIENCIA, TECNOLOGIA Y MEDIO AMBIENTE EN GUANTANAMO;;AHOGADO NO. 14 E/ 12 Y 13 NORTE, RPTO. CARIBE;31/08/1989;3509;7514;0;211;999;2;UP;05;0;00211
06798;CENTRO DE GESTION DE LA INFORMACION Y DESARROLLO DE LA ENERGIA;CUBAENERGIA;CALLE 20 NO. 4111 E/ 18A Y 47, MIRAMAR;31/01/1990;2301;9431;0;211;648;2;UP;07;0;12526
06803;UNIVERSIDAD DE CIENCIAS MEDICAS DE LA HABANA;;AVENIDA 150, NO. 2514, ENTRE 25 Y 31.;31/01/1977;2301;8650;0;241;999;2;UP;05;0;00241
06804;UNIVERSIDAD DE CIENCIAS MEDICAS DE VILLA CLARA;;CARRETERA DEL ACUEDUCTO E/ CIRCUNVALACION Y DOBLE VIA;31/01/1977;2609;8650;0;241;999;2;UP;05;0;00241
06805;UNIVERSIDAD DE CIENCIAS MEDICAS DE SANTIAGO DE CUBA;;AVE. LAS AMERICAS Y CALLE J;31/01/1977;3406;8650;0;241;999;2;UP;05;0;00241
06812;DIRECCION MUNICIPAL DE COMUNALES DE MINAS;;MORALITOS NO. 672 A;31/01/1996;3004;9600;0;319;999;2;UP;05;2;00474
06814;UNIVERSIDAD DE PINAR DEL RIO HERMANOS SAIZ MONTES DE OCA;UPR;CALLE MARTI NO. 270 ESQ. A 27 DE NOVIEMBRE;31/01/1977;2108;8650;0;223;999;2;UP;05;0;00223
06815;UNIVERSIDAD AGRARIA DE LA HABANA FRUCTUOSO RODRIGUEZ;UNAH;AUTOPISTA NACIONAL Y CARRETERA DE TAPASTE;31/01/1977;2402;8650;0;223;999;2;UP;05;0;00223
06816;UNIVERSIDAD DE LA HABANA;;SAN LAZARO ESQ. L, VEDADO;31/01/1977;2302;8650;0;223;999;2;UP;05;0;00223
06817;UNIVERSIDAD TECNOLOGICA DE LA HABANA JOSE ANTONIO ECHEVERRIA;CUJAE;CALLE 114 NO. 11901 E/ CICLOVIA Y ROTONDA.;31/01/1977;2311;8650;0;223;999;2;UP;05;0;00223
06818;UNIVERSIDAD DE MATANZAS;;CARRETERA DE VARADERO KM 3,5;31/01/1977;2501;8650;0;223;999;2;UP;05;0;00223
06819;UNIVERSIDAD CENTRAL MARTA ABREU DE LAS VILLAS;;CARRETERA DE CAMAJUANI KM 5 1/2;31/01/1977;2609;8650;0;223;999;2;UP;05;0;00223
06820;UNIVERSIDAD DE CAMAGUEY IGNACIO AGRAMONTE Y LOYNAZ;;CARRETERA CIRCUNVALACION NORTE KM 5;31/01/1977;3008;8650;0;223;999;2;UP;05;0;00223
06821;UNIVERSIDAD DE HOLGUIN;;AVENIDA XX ANIVERSARIO, PLAZA DE LA REVOLUCION;31/01/1977;3206;8650;0;223;999;2;UP;05;0;00223
06822;INSTITUTO SUPERIOR MINERO-METALURGICO MOA;;LAS COLORADAS, MOA;31/01/1977;3214;8650;0;223;999;2;UP;05;0;00223
06823;UNIVERSIDAD DE GRANMA;;CARRETERA DE MANZANILLO KM 17 1/2;31/01/1977;3304;8650;0;223;999;2;UP;05;0;00223
06824;UNIVERSIDAD DE ORIENTE;;AVENIDA PATRICIO LUMUMBA S/N;31/01/1977;3406;8650;0;223;999;2;UP;05;0;00223
06828;UNIVERSIDAD DE CIENCIAS PEDAGOGICAS ENRIQUE JOSE VARONA DE LA HABANA;;CIUDAD LIBERTAD;31/01/1977;2311;8650;0;223;999;2;UP;05;0;00221
06836;INSTITUTO MARITIMO PESQUERO ANDRES GONZALEZ LINES;;CARRETERA PANAMERICANA S/N;31/01/1977;2202;8522;0;111;999;2;UP;05;0;00111
06839;ESCUELA SUPERIOR DEL PARTIDO COMUNISTA DE CUBA NICO LOPEZ;;5TA. AVE. E/ 246 Y RIO JAIMANITAS;31/01/1977;2301;8650;0;501;999;2;UP;05;0;
06841;UNIVERSIDAD DE LAS ARTES;;CALLE 120 NO.1110 E/.9NA Y 23, CUBANACAN;31/01/1977;2301;8650;0;234;999;2;UP;05;0;00234
06842;CENTRO NACIONAL DE ESCUELAS DE ARTE;CNEART;CALLE 34, NO. 513, ENTRE 5TA AVENIDA Y 7MA;31/01/1977;2301;8522;0;234;999;2;UP;05;0;00234
06847;UNIDAD PRESUPUESTADA DIRECCION MUNICIPAL DE EDUCACION MANTUA;;CALLE CARLOS MANUEL DE CESPEDES NO. 283-A;31/01/1977;2102;8511;0;311;999;2;UP;05;2;00312
06848;UNIDAD PRESUPUESTADA DIRECCION MUNICIPAL DE EDUCACION SANDINO;;ZONA G EDIFICIO FILIAL PEDAGOGICA;31/01/1977;2101;8511;0;311;999;2;UP;05;2;00311
06849;UNIDAD PRESUPUESTADA DIRECCION MUNICIPAL DE EDUCACION MINAS DE MATAHAMBRE;;PASEO RUISENOR;31/01/1977;2103;8511;0;311;999;2;UP;05;2;00313
06850;UNIDAD PRESUPUESTADA DIRECCION MUNICIPAL DE EDUCACION VINALES;;CALLE SERGIO DOPICO S/N;31/01/1977;2104;8511;0;311;999;2;UP;05;2;00314
06852;UNIDAD PRESUPUESTADA DIRECCION MUNICIPAL DE EDUCACION LA PALMA;;AVE. LIBERATO D AZCUY NO. 66 E/ MACEO Y FRANCISCO CRUZ RES;31/01/1977;2105;8511;0;311;999;2;UP;05;2;00315
06856;UNIDAD PRESUPUESTADA DIRECCION MUNICIPAL DE EDUCACION LOS PALACIOS;;CALLE 23 NO. 2612 E/ 26 Y 28;31/01/1977;2106;8511;0;311;999;2;UP;05;2;00319
06857;UNIDAD PRESUPUESTADA DIRECCION MUNICIPAL DE EDUCACION CONSOLACION DEL SUR;;CALLE 62 NO. 5301 E/ 51 Y 53;31/01/1977;2107;8511;0;311;999;2;UP;05;2;00321
06858;UNIDAD PRESUPUESTADA DIRECCION MUNICIPAL DE EDUCACION PINAR DEL RIO;;MAXIMO GOMEZ NO. 49 ALTOS E/ GERARDO MEDINA E ISABEL RUBIO;31/01/1977;2108;8511;0;311;999;2;UP;05;2;00322
06859;UNIDAD PRESUPUESTADA DIRECCION MUNICIPAL DE EDUCACION SAN LUIS;;AMPLIACION CALLE CESPEDES S/N;31/01/1977;2109;8511;0;311;999;2;UP;05;2;00323
06860;UNIDAD PRESUPUESTADA DIRECCION MUNICIPAL DE EDUCACION SAN JUAN Y MARTINEZ;;FRANCISCO RIVERA NO. 18;31/01/1977;2110;8511;0;311;999;2;UP;05;2;00324
06861;UNIDAD PRESUPUESTADA DIRECCION MUNICIPAL DE EDUCACION GUANE;;CALLE ISABEL RUBIO NO. 114 E/ CAPITAN MURRIETA Y RAMON PEREZ;31/01/1977;2111;8511;0;311;999;2;UP;05;2;00325
06862;UNIDAD PRESUPUESTADA PROVINCIAL DE EDUCACION PINAR DEL RIO;;HERMANO SAIZ NO. 21 E/ MARTI Y AMPLIACION MACEO;31/01/1977;2108;7512;0;311;999;2;UP;05;1;
06882;UNIDAD PRESUPUESTADA DIRECCION MUNICIPAL DE EDUCACION DE PLAYA;;30 NO. 105 E/ 1RA Y 3RA;31/01/1977;2301;8511;0;313;999;2;UP;05;2;00361
06883;UNIDAD PRESUPUESTADA DIRECCION MUNICIPAL DE EDUCACION DE PLAZA DE LA REVOLUCION;;21 S/N ESQ. H, VEDADO;31/01/1977;2302;8511;0;313;999;2;UP;05;2;00362
06884;UNIDAD PRESUPUESTADA DIRECCION MUNICIPAL DE EDUCACION DE CENTRO HABANA;;MARQUEZ GONZALEZ Y SALVADOR ALLENDE, EDIFICIO MAZONICO;31/01/1977;2303;8511;0;313;999;2;UP;05;2;00363
06885;UNIDAD PRESUPUESTADA DIRECCION MUNICIPAL DE EDUCACION DE LA HABANA VIEJA;;ORELLY NO. 414 E/ COMPOSTELA Y AGUACATE;31/01/1977;2304;8511;0;313;999;2;UP;05;2;00364
06886;UNIDAD PRESUPUESTADA DIRECCION MUNICIPAL DE EDUCACION DE REGLA;;CALLE ROTARIA S/N ENTRE ENLACE Y CIRUELA REGLA;31/01/1977;2305;8511;0;313;999;2;UP;05;2;00365
06887;UNIDAD PRESUPUESTADA DIRECCION MUNICIPAL DE EDUCACION DE LA HABANA DEL ESTE;;168 NO. 36 ZONA 8, ALAMAR;31/01/1977;2306;8511;0;313;999;2;UP;05;2;00366
06889;UNIDAD PRESUPUESTADA DIRECCION MUNICIPAL DE EDUCACION DE GUANABACOA;;MAXIMO GOMEZ NO. 1 ESQ. SAN FRANCISCO, EDIFICIO ESCOLAPIOS;31/01/1977;2307;8511;0;313;999;2;UP;05;2;00367
06890;UNIDAD PRESUPUESTADA DIRECCION MUNICIPAL DE EDUCACION DE SAN MIGUEL DEL PADRON;;AVE. CALIFORNIA ESQ. A 2DA, REPARTO CALIFORNIA;31/01/1977;2308;8511;0;313;999;2;UP;05;2;00368
06891;UNIDAD PRESUPUESTADA DIRECCION MUNICIPAL DE EDUCACION DE DIEZ DE OCTUBRE;;AVENIDA SANTA CATALINA NO. 207 E/ LUZ CABALLERO Y JOSE ANTONIO SACO, VIBORA;31/01/1977;2309;8511;0;313;999;2;UP;05;2;00369
06892;UNIDAD PRESUPUESTADA DIRECCION MUNICIPAL DE EDUCACION DE CERRO;;CALZADA DEL CERRO NO. 360 E/ PATRIA Y ZANABRIA;31/01/1977;2310;8511;0;313;999;2;UP;05;2;00371
06894;UNIDAD PRESUPUESTADA DIRECCION MUNICIPAL DE EDUCACION DE MARIANAO;;29-F NO. 8209 E/ 80 Y 82, CIUDAD LIBERTAD;31/01/1977;2311;8511;0;313;999;2;UP;05;2;00372
06895;UNIDAD PRESUPUESTADA DIRECCION MUNICIPAL DE EDUCACION DE LA LISA;;AVE.51 NO. 10008 E/ 180 Y 190;31/01/1977;2312;8511;0;313;999;2;UP;05;2;00373
06897;UNIDAD PRESUPUESTADA DIRECCION MUNICIPAL DE EDUCACION DE BOYEROS;;6 S/N E/ 9 Y 11, SANTIAGO DE LAS VEGAS;31/01/1977;2313;8511;0;313;999;2;UP;05;2;00374
06898;UNIDAD PRESUPUESTADA INSTITUTO PREUNIVERSITARIO VOCACIONAL DE CIENCIAS EXACTAS VLADIMIR I. LENIN;;CARRETERA EL GLOBO, LAS GUASIMAS, CALABAZAR, KM. 2 1/2;31/01/1977;2314;8521;0;313;999;2;UP;05;1;
06899;UNIDAD PRESUPUESTADA DIRECCION MUNICIPAL DE EDUCACION DE ARROYO NARANJO;;CALZADA DE MANAGUA AVEROFF NO. 1 ENTRE FERNANDO Y ESTELA;31/01/1977;2314;8511;0;313;999;2;UP;05;2;00375
06900;UNIDAD PRESUPUESTADA DIRECCION MUNICIPAL DE EDUCACION DE COTORRO;;AVENIDA 101 NUMERO 3022 ENTRE 30 Y 32;31/01/1977;2315;8511;0;313;999;2;UP;05;2;00376
06902;UNIDAD PRESUPUESTADA MUNICIPAL DIRECCION EDUCACION MATANZAS;;MILANES E/ AMERICA Y DOS DE MAYO.;31/01/1977;2501;8511;0;314;999;2;UP;05;2;00381
06903;UNIDAD PRESUPUESTADA MUNICIPAL DIRECCION EDUCACION CARDENAS;;CESPEDES NO. 624 ESQ. VELAZQUEZ.;31/01/1977;2502;8511;0;314;999;2;UP;05;2;00382
06905;UNIDAD PRESUPUESTADA MUNICIPAL DIRECCION EDUCACION MARTI;;MACEO 219;31/01/1977;2503;8511;0;314;999;2;UP;05;2;00384
06906;UNIDAD PRESUPUESTADA MUNICIPAL DIRECCION EDUCACION COLON;;MESA NO. 108 E/ GONZALO DE QUESADA Y COLON.;31/01/1977;2504;8511;0;314;999;2;UP;05;2;00385
06907;UNIDAD PRESUPUESTADA MUNICIPAL DIRECCION EDUCACION PERICO;;CAMILO CIENFUEGOS E/ LINEA Y ALVAREZ;31/01/1977;2505;8511;0;314;999;2;UP;05;2;00386
06908;UNIDAD PRESUPUESTADA MUNICIPAL DIRECCION EDUCACION JOVELLANOS;;AVE. 14 NO. 1105 (PLANTA ALTA Y BAJA), ENTRE 11 Y 13;31/01/1977;2506;8511;0;314;999;2;UP;05;2;00387
06909;UNIDAD PRESUPUESTADA MUNICIPAL DIRECCION EDUCACION PEDRO BETANCOURT;;CALLE 22 NO. 2511 ENTRE 25 Y 27;31/01/1977;2507;8511;0;314;999;2;UP;05;2;00388
06910;UNIDAD PRESUPUESTADA MUNICIPAL DIRECCION EDUCACION LIMONAR;;MAXIMO GOMEZ NO. 102 E/ NELSON FERNANDEZ Y GENERAL BETANCOURT.;31/01/1977;2508;8511;0;314;999;2;UP;05;2;00389
06911;UNIDAD PRESUPUESTADA MUNICIPAL DIRECCION EDUCACION UNION DE REYES;;BENITO FERRER NO. 15 E/ JOSE MARTI Y JOAQUIN CUERVO.;31/01/1977;2509;8511;0;314;999;2;UP;05;2;00391
06912;UNIDAD PRESUPUESTADA MUNICIPAL DIRECCION EDUCACION CIENAGA;;ENTRONQUE PLAYA LARGA;31/01/1977;2510;8511;0;314;999;2;UP;05;2;00392
06915;UNIDAD PRESUPUESTADA MUNICIPAL DIRECCION EDUCACION CALIMETE;;INDEPENDENCIA NO. 1 E/ 4 Y FINAL.;31/01/1977;2512;8511;0;314;999;2;UP;05;2;00394
06916;UNIDAD PRESUPUESTADA MUNICIPAL DIRECCION EDUCACION LOS ARABOS;;CALLE MACEO NO. 92 E/ JUAN CLEMENTE ZENEA Y QUINTA;31/01/1977;2513;8511;0;314;999;2;UP;05;2;00395
06917;UNIDAD PRESUPUESTADA MUNICIPAL DE EDUCACION CORRALILLO;;INDEPENDENCIA NO. 22 E/N MAXIMO GOMEZ Y CESPEDES;31/01/1977;2601;8511;0;315;999;2;UP;05;2;00411
06918;UNIDAD PRESUPUESTADA MUNICIPAL DE EDUCACION QUEMADO DE GUINES;;CALLE 3RA AVENIDA DEL SUR, NUMERO 2 ENTRE CALLE CENTRAL OESTE Y SEGUNDA DEL OESTE;31/01/1977;2602;8511;0;315;999;2;UP;05;2;00412
06919;UNIDAD PRESUPUESTADA MUNICIPAL DE EDUCACION SAGUA LA GRANDE;;COLON NO. 216 E/ N MARTA ABREU Y VARONA;31/01/1977;2603;8511;0;315;999;2;UP;05;2;00413
06920;UNIDAD PRESUPUESTADA MUNICIPAL DE EDUCACION ENCRUCIJADA;;CALLE 1RA DEL OESTE NO. 54 E/ 7MA Y 9NA DEL NORTE;31/01/1977;2604;8511;0;315;999;2;UP;05;2;00414
06921;UNIDAD PRESUPUESTADA MUNICIPAL DE EDUCACION CAMAJUANI;;JOAQUIN PANECA NO. 85, ENTRE RAUL TORRES Y LEONCIO VIDAL;31/01/1977;2605;8511;0;315;999;2;UP;05;2;00415
06922;UNIDAD PRESUPUESTADA MUNICIPAL DE EDUCACION CAIBARIEN;;CALLE 20 ENTRE 13 Y 15, NUMERO 1301;31/01/1977;2606;8511;0;315;999;2;UP;05;2;00416
06923;UNIDAD PRESUPUESTADA MUNICIPAL DE EDUCACION REMEDIOS;;CALLE ALEJANDRO DEL RIO # 108 ENTRE GONZALO DE QUEZADA Y HERMANOS GARCIA;31/01/1977;2607;8511;0;315;999;2;UP;05;2;00417
06924;UNIDAD PRESUPUESTADA MUNICIPAL DE EDUCACION PLACETAS;;CALLE 1RA DEL OESTE ENTRE CARRETERA CENTRAL Y 1RA DEL NORTE, NUMERO 37;31/01/1977;2608;8511;0;315;999;2;UP;05;2;00418
06926;UNIDAD PRESUPUESTADA PROVINCIAL ESCUELA VOCACIONAL SANTA CLARA;;CARRETERA A CAMAJUANI KM 3 1/2;31/01/1977;2609;8521;0;315;999;2;UP;05;1;00410
06930;UNIDAD PRESUPUESTADA MUNICIPAL DE EDUCACION CIFUENTES;;MARTI NO. 103 A E/N CALIXTO GARCIA Y J.R. LANZA;31/01/1977;2610;8511;0;315;999;2;UP;05;2;00421
06931;UNIDAD PRESUPUESTADA MUNICIPAL DE EDUCACION SANTO DOMINGO;;CALLE FRUCTUOSO RODRIGUEZ, NUMERO 5, ENTRE INDEPENDENCIA Y LINEA, BANDA BALINO;31/01/1977;2611;8511;0;315;999;2;UP;05;2;00422
06932;UNIDAD PRESUPUESTADA MUNICIPAL DE EDUCACION RANCHUELO;;RAMIRO LAVANDERO NO. 31 E/N MAXIMO GOMEZ Y LEONCIO VIDAL.;31/01/1977;2612;8511;0;315;999;2;UP;05;2;00423
06933;UNIDAD PRESUPUESTADA MUNICIPAL DE EDUCACION MANICARAGUA;;CALLE ORIENTE NORTE NO. 27 Y AVENIDA LIBERTAD;31/01/1977;2613;8511;0;315;999;2;UP;05;2;00424
06934;UNIDAD PRESUPUESTADA MUNICIPAL DE EDUCACION RODAS;;CALLE CESPEDES NO. 87-B E/ CORONEL RODRIGUEZ Y MARTI;31/01/1977;2702;8511;0;316;999;2;UP;05;2;00432
06935;UNIDAD PRESUPUESTADA MUNICIPAL DE EDUCACION AGUADA DE PASAJEROS;;CALIXTO GARCIA NO. 81 E/ AGUILERA Y AGRAMONTE;31/01/1977;2701;8511;0;316;999;2;UP;05;2;00431
06936;UNIDAD PRESUPUESTADA MUNICIPAL DE EDUCACION PALMIRA;;VILLUENDAS NO. 45 E/ CAMILO CIENFUEGOS Y PORTELA;31/01/1977;2703;8511;0;316;999;2;UP;05;2;00433
06937;UNIDAD PRESUPUESTADA MUNICIPAL DE EDUCACION LAJAS;;DR. MACHIN NO. 103 E/ CALIXTO GARCIA Y MARTI;31/01/1977;2704;8511;0;316;999;2;UP;05;2;00434
06938;UNIDAD PRESUPUESTADA MUNICIPAL DE EDUCACION CRUCES;;PASEO GOMEZ NO. 609 E/ CALIXTO GARCIA Y MONTEAGUDO;31/01/1977;2705;8511;0;316;999;2;UP;05;2;00435
06939;UNIDAD PRESUPUESTADA MUNICIPAL DE EDUCACION CUMANAYAGUA;;CALLE MENENDEZ PELAEZ NO. 100 E/ TREJO Y NAPOLEON DIEGO;31/01/1977;2706;8511;0;316;999;2;UP;05;2;00436
06940;UNIDAD PRESUPUESTADA MUNICIPAL DE EDUCACION CIENFUEGOS;;AVE. 54 NO. 4512 E/ 45 Y 47;31/01/1977;2707;8511;0;316;999;2;UP;05;2;00437
06943;UNIDAD PRESUPUESTADA MUNICIPAL DE EDUCACION ABREUS;;AVE. LIBERTAD S/N E/ LA BARCA Y CALLE MACEO;31/01/1977;2708;8511;0;316;999;2;UP;05;2;00438
06944;UNIDAD PRESUPUESTADA MUNICIPAL DIRECCION EDUCACION YAGUAJAY;;PANCHITO GOMEZ NO.84;31/01/1977;2801;8511;0;317;999;2;UP;05;2;00441
06945;UNIDAD PRESUPUESTADA MUNICIPAL DIRECCION EDUCACION JATIBONICO;;MACEO NO.191;31/01/1977;2802;8511;0;317;999;2;UP;05;2;00442
06946;UNIDAD PRESUPUESTADA MUNICIPAL DIRECCION EDUCACION TAGUASCO;;FRANK PAIS NO.12 E/CAMILO CIENFUEGOS Y LEONEL BARRIO;31/01/1977;2803;8511;0;317;999;2;UP;05;2;00443
06947;UNIDAD PRESUPUESTADA MUNICIPAL DIRECCION EDUCACION CABAIGUAN;;EMILIO R. CAPESTANY NO. 1 E/ SERGIO ESPINOSA Y MANOLO GONZALEZ;31/01/1977;2804;8511;0;317;999;2;UP;05;2;00444
06948;UNIDAD PRESUPUESTADA MUNICIPAL DIRECCION EDUCACION FOMENTO;;MAXIMO GOMEZ S/N E/CESPEDES Y SERAFIN SANCHEZ;31/01/1977;2805;8511;0;317;999;2;UP;05;2;00445
06949;UNIDAD PRESUPUESTADA MUNICIPAL DIRECCION EDUCACION TRINIDAD;;FRANK PAIS NO.254 E/ANTONIO GUITERAS Y ALMIRANTE CRISTOBAL COLON;31/01/1977;2806;8511;0;317;999;2;UP;05;2;00446
06951;UNIDAD PRESUPUESTADA MUNICIPAL DIRECCION EDUCACION SANCTI SPIRITUS;;AVE. DE LOS MARTIRES NO.60 E/ CESPEDES Y MARTI;31/01/1977;2807;8511;0;317;999;2;UP;05;2;00447
06952;UNIDAD PRESUPUESTADA MUNICIPAL DIRECCION EDUCACION CHAMBAS;;RIGOBERTO PEREZ CARBO NO. 76 E/ AGRAMONTE Y PROYECTO;31/01/1977;2901;8511;0;318;999;2;UP;05;2;00451
06953;UNIDAD PRESUPUESTADA MUNICIPAL DIRECCION EDUCACION MORON;;ZAYAS NO. 292 E/ RECEDAD Y CARLOS MANUEL DE CESPEDES;31/01/1977;2902;8511;0;318;999;2;UP;05;2;00452
06954;UNIDAD PRESUPUESTADA MUNICIPAL DIRECCION EDUCACION BOLIVIA;;OLO PANTOJA OESTE S/N.;31/01/1977;2903;8511;0;318;999;2;UP;05;2;00453
06955;UNIDAD PRESUPUESTADA MUNICIPAL DIRECCION EDUCACION PRIMERO DE ENERO;;CALLE 7 NO. 15 ENTRE F Y G;31/01/1977;2904;8511;0;318;999;2;UP;05;2;00454
06956;UNIDAD PRESUPUESTADA MUNICIPAL DIRECCION EDUCACION CIRO REDONDO;;CAMILO CIENFUEGOS NO.54 E/ AVENIDA DE LOS PATRIOTAS Y RAMONA IDABOY;31/01/1977;2905;8511;0;318;999;2;UP;05;2;00455
06957;UNIDAD PRESUPUESTADA MUNICIPAL DIRECCION EDUCACION FLORENCIA;;CALLE ISABEL VICTORIA NO. 15 E/ EMERIO SANCHEZ Y RAUL GALAN;31/01/1977;2906;8511;0;318;999;2;UP;05;2;00456
06958;UNIDAD PRESUPUESTADA MUNICIPAL DIRECCION EDUCACION MAJAGUA;;CARRETERA ORLANDO GONZALEZ S/N;31/01/1977;2907;8511;0;318;999;2;UP;05;2;00457
