09869;DIRECCION PROVINCIAL DE TRABAJO DE CIEGO DE AVILA;;CARRETERA CENTRAL, INTERIOR VILLA MARIA, E/ INDEPENDENCIA Y MAXIMO GOMEZ;30/06/1987;2908;7514;0;318;999;2;UP;05;1;
09870;DIRECCION PROVINCIAL DE TRABAJO DE LAS TUNAS;;LUCAS ORTIZ NO. S/N ESQ. ADOLFO VILLAMAR;30/06/1987;3105;7514;0;320;999;2;UP;05;1;
09871;DIRECCION PROVINCIAL DE TRABAJO DE GRANMA;;SACO NO. 260 E/ CAPOTICO Y PIO ROSADO;30/06/1987;3304;7514;0;322;999;2;UP;05;1;
09872;DIRECCION PROVINCIAL DE TRABAJO DE GUANTANAMO;;BENEFICIENCIA E/ B. VARONA Y PINTO;30/06/1987;3509;7514;0;324;999;2;UP;05;1;
09899;GRAN PARQUE METROPOLITANO DE LA HABANA;;19 NO. 1466 E/ 28 Y 30;30/04/1990;2302;7511;0;313;999;2;UP;07;1;00360
09902;COMITE PROVINCIAL DEL PCC PINAR DEL RIO;;AVE. COMANDANTE PINARES NO. 117 E/ AMPLIACION DE MACEO Y ESTACION DEL FERROCARRIL;31/01/1977;2108;9792;0;501;999;1;OPM;29;0;
09904;COMITE PROVINCIAL DEL PCC CIUDAD DE LA HABANA;;CALLE M NO. 309 E/ 23 Y 21, VEDADO;31/01/1977;2302;9792;0;501;999;1;OPM;29;0;
09905;COMITE PROVINCIAL DEL PCC MATANZAS;;MILANES NO. 29002 E/ SANTA TERESA Y ZARAGOZA;31/01/1977;2501;9792;0;501;999;1;OPM;29;0;
09906;COMITE PROVINCIAL DEL PCC VILLA CLARA;;AVE. LIBERACION NO. 160 E/ CALLE E Y TOMAS RUIZ;31/01/1977;2609;9792;0;501;999;1;OPM;29;0;
09907;COMITE PROVINCIAL DEL PCC CIENFUEGOS;;AVE. 54 NO. 3029 E/ 39 Y 41;31/01/1977;2707;9792;0;501;999;1;OPM;29;0;
09908;COMITE PROVINCIAL DEL PCC SANCTI SPIRITUS;;BRIGADIER RIVVER NO. 199 E/ FRANK PAIS Y PLAZA DE LA REVOLUCION;31/01/1977;2807;9792;0;501;999;1;OPM;29;0;
09909;COMITE PROVINCIAL DEL PCC CIEGO DE AVILA;;PLAZA MAXIMO GOMEZ;31/01/1977;2908;9792;0;501;999;1;OPM;29;0;
09910;COMITE PROVINCIAL DEL PCC CAMAGUEY;;ENRIQUE VILLUENDA NO. 2 E/ RAMON PONTE Y CABALLERO ROJO;31/01/1977;3008;9792;0;501;999;1;OPM;29;0;
09911;COMITE PROVINCIAL DEL PCC LAS TUNAS;;AVE. 30 DE NOVIEMBRE;31/01/1977;3105;9792;0;501;999;1;OPM;29;0;
09912;COMITE PROVINCIAL DEL PCC HOLGUIN;;AVE. 20 ANIVERSARIO, PLAZA DE LA REVOLUCION;31/01/1977;3206;9792;0;501;999;1;OPM;29;0;
09913;COMITE PROVINCIAL DEL PCC GRANMA;;AVE. FRANK PAIS ESQ. A CALLE 2, RPTO. JESUS MENENDEZ;31/01/1977;3304;9792;0;501;999;1;OPM;29;0;
09914;COMITE PROVINCIAL DEL PCC SANTIAGO DE CUBA;;GARZON NO. 51 E/ SANCHEZ ECHEVARRIA Y CARRETERA CENTRAL;31/01/1977;3406;9792;0;501;999;1;OPM;29;0;
09915;COMITE PROVINCIAL DEL PCC GUANTANAMO;;CALLE AHOGADOS E/ 12 Y 13 NORTE NO. 1, RPTO. CARIBE;31/01/1977;3509;9792;0;501;999;1;OPM;29;0;
09916;COMITE MUNICIPAL ESPECIAL DEL PCC ISLA DE LA JUVENTUD;;CARRETERA CENTRAL KM. 1 1/2, NUEVA GERONA;31/01/1977;4001;9792;0;501;999;1;OPM;29;0;
09919;UNION NACIONAL DE ESCRITORES Y ARTISTAS DE CUBA;UNEAC;CALLE 17 NO. 351 ESQUINA A H, VEDADO;31/08/1977;2302;9792;0;998;999;1;AS;30;0;
09920;UNION DE PERIODISTAS DE CUBA;UPEC;CALLE 23 NO. 452, ENTRE H E I;30/01/1971;2302;9711;0;998;999;1;AS;30;0;
09924;OFICINA REGIONAL DE COORDINACION DE LA FEDERACION DEMOCRATICA INTERNACIONAL DE MUJERES PARA AMERICA Y EL CARIBE (FDIM);;CALLE 20 NO. 117 ENTRE AVENIDA 1RA Y AVENIDA 3RA, MIRAMAR;05/01/1978;2301;9893;0;505;999;1;AS;30;0;00505
09937;CENTRO DE ESTUDIOS SOBRE ASIA Y OCEANIA;;CALLE 20 NO. 512 E/ 5TA. Y 7MA, MIRAMAR;30/05/1985;2301;8120;0;501;999;2;UP;05;0;
09960;CENTRO DE ESTUDIO DE AMERICA;;CALLE 18 NO. 316 E/ 3RA. Y 5TA, MIRAMAR;30/01/1990;2301;8120;0;501;999;2;UP;05;0;
09985;CENTRO MEDICO PROVINCIAL PSICOPEDAGOGICO FREDDY MAYMURA HURTADO;;CARRETERA DE CAMAJUANI KM 2 Y MEDIO;30/09/1996;2609;9131;0;315;999;2;UP;05;1;
09986;BANCO DE SANGRE DE VILLA CLARA;;CALLE MACEO E/N NAZARENO Y SINDICO;30/09/1996;2609;9019;0;315;999;2;UP;05;1;
09987;EMPRESA DE SERVICIOS TECNICOS DE COMPUTACION, COMUNICACIONES Y ELECTRONICA DEL NIQUEL RAFAEL FAUSTO OREJON FORMET;SERCONI;CALLE 1RA. NO. 143, ROLO MONTERREY;30/09/1996;3214;7050;1;104;618;1;EMP;02;0;02590
09990;EMPRESA DE SERVICIOS A GRUPOS ELECTROGENOS;EMER ELECTRÓGENO DE EMERGENCIA;CALLE 29, NO. 10601, ENTRE 106 Y 108, REPARTO MACHIN;30/09/1996;2311;3510;1;104;620;1;EMP;02;0;02704
09993;UNIDAD PROVINCIAL PARA LA ATENCION A LAS COMUNIDADES DE TRANSITO;;7MA NO. 6008 E/ 60 Y 62;31/10/1996;2301;5520;0;313;999;2;UP;05;1;
09994;EMPRESA PROVINCIAL DE GASTRONOMIA DE LA HABANA;;PRADO NO.152 ESQUINA A REFUGIO;31/10/1996;2304;5610;0;313;999;1;EMP;02;1;00360
09995;DIRECCION PROVINCIAL DE ECONOMIA Y PLANIFICACION LA HABANA;;AGUIAR NO. 70 E/ PENA POBRE Y CUARTELES;31/10/1996;2304;7513;0;313;999;2;UP;05;1;00360
09996;CENTRO DE ESTUDIOS CONTABLES, FINANCIEROS Y DE SEGUROS;CECOFIS;CALLE B NO. 55 E/ 3RA. Y 5TA.;31/10/1996;2302;8710;0;254;999;2;UP;05;0;
11001;DIRECCION PROVINCIAL DE LA VIVIENDA DE SANCTI SPIRITUS;;CESPEDES NO. 158 NORTE E/ FRANK PAIS Y SILVESTRE ALONSO;31/01/1998;2807;7330;0;317;999;2;UP;05;1;
11003;REGISTRO CENTRAL DE SANCIONADOS;;CALLE 9 NO. 158 ESQUINA A E, VEDADO;31/01/1998;2302;7514;0;263;999;2;UP;05;0;
11004;CAJA DE RESARCIMIENTO;;CALLE E NO. 158 ESQUINA A 9, VEDADO;31/01/1998;2302;7511;0;263;999;2;UP;05;0;
11005;EMPRESA DE INGENIERIA DEL RECICLAJE;ISDE;INFANTA NO. 60 ESQ. 25;31/10/1996;2303;7120;0;102;670;1;EMP;02;0;05923
11006;EMPRESA DE SERVICIOS TECNICOS Y TRANSPORTACION;;CARRET. CENTRAL KM 14 1/2;31/10/1996;2315;5149;0;102;670;1;EMP;02;0;05923
11007;EMPRESA DE ASEGURAMIENTO Y SERVICIOS;;CALLE VIVES, NO. 463, E/ RASTRO Y CHAMORRO;31/10/1996;2304;5190;0;102;670;1;EMP;02;0;05923
11009;EMPRESA DE RECUPERACION DE MATERIAS PRIMAS DE SANCTI SPIRITUS;;AVENIDA SOVIETICA, S/N ESQUINA A 26 DE JULIO, REPARTO COLON;31/10/1996;2807;5149;1;102;670;1;EMP;02;0;05923
11010;EMPRESA DE RECUPERACION DE MATERIAS PRIMAS DE CIENFUEGOS;;AVENIDA 64 NO. 5901 E/ 59 Y 61;31/10/1996;2707;5149;1;102;670;1;EMP;02;0;05923
11011;EMPRESA DE RECUPERACION DE MATERIAS PRIMAS DE GUANTANAMO;;CARRETERA JAMAICA KM 3 1/2;31/10/1996;3509;5149;1;102;670;1;EMP;02;0;05923
11013;EMPRESA TRANSITARIO DE CARGAS;TRANSCARGO;FABRICA NO. 54 SEXTO PISO ENTRE ASPURU Y LINEA DEL FERROCARRIL;31/10/1996;2304;6110;1;151;855;1;EMP;02;0;11769
11015;EMPRESA AVICOLA ARTEMISA;;FINCA WATERLOO, CARRETERA LA RONCHA;31/01/1998;2209;0313;0;131;699;1;EMP;02;0;14508
11016;DIRECCION MUNICIPAL DE SERVICIOS COMUNALES DE CAIMANERA;;CARRETERA NO. 1-A E/ 1RO DE MAYO Y CORREO;31/10/1996;3508;9600;0;324;999;2;UP;05;2;00569
11017;DIRECCION MUNICIPAL DE SERVICIOS COMUNALES DE SAN ANTONIO DEL SUR;;CALLE 5 NO. 341, RPTO. MINCIN;31/10/1996;3507;9600;0;324;999;2;UP;05;2;00567
11018;DIRECCION MUNICIPAL DE SERVICIOS COMUNALES DE MAISI;;LA ASUNCION;31/10/1996;3505;9600;0;324;999;2;UP;05;2;00565
11019;DIRECCION MUNICIPAL DE SERVICIOS COMUNALES DE MANUEL TAMES;;CALLE MARIANA GRAJALES ENTRE CIRO FRIA Y CARLOS TORANZO;31/10/1996;3502;9600;0;324;999;2;UP;05;2;00568
11020;DIRECCION MUNICIPAL DE SERVICIOS COMUNALES DE IMIAS;;CALLE C NO. 58;31/10/1996;3506;9600;0;324;999;2;UP;05;2;00566
11021;DIRECCION MUNICIPAL DE SERVICIOS COMUNALES DE YATERAS;;PALENQUE;31/10/1996;3503;9600;0;324;999;2;UP;05;2;00563
11022;DIRECCION MUNICIPAL DE DEPORTES DE BARACOA;;ESTADIUM MANUEL FUENTES BORGES, LA PASADA;31/10/1996;3504;9510;0;324;999;2;UP;05;2;00564
11023;DIRECCION MUNICIPAL DE DEPORTES DE GUANTANAMO;;MONCADA NO. 874 ESQ. CROMBET;31/10/1996;3509;9510;0;324;999;2;UP;05;2;00562
11025;EMPRESA PROVINCIAL DE SERVICIOS ESPECIALIZADOS DE LA CONSTRUCCION;SECONS;CALLE SANTA CATALINA NO. 560 E/ MAYIA RODRIGUEZ Y GOICURIA;30/11/1996;2309;4520;1;313;999;1;EMP;02;1;00360
11027;HOSPITAL CLINICO QUIRURGICO DE HOLGUIN;;CARRETERA VIA VALLE DE MAYABE;30/11/1996;3206;9011;0;321;999;2;UP;05;1;
11031;EMPRESA DE SEGURIDAD Y PROTECCION DEL CITMA;;CALLE 13 NO. 409 E/ F Y G, VEDADO;28/02/1998;2302;7290;0;211;712;1;EMP;02;0;12714
11032;UNIVERSIDAD DE GUANTANAMO;;CARRETERA A SANTIAGO DE CUBA, KILOMETRO DOS Y MEDIO;28/02/1998;3509;8650;0;223;999;2;UP;05;0;00223
11033;DIRECCION PROVINCIAL DE JUSTICIA DE SANCTI SPIRITUS;;CALLE MARTI NO. 52 SUR E/ ERNESTO VALDES MUNOZ Y RAIMUNDO DE PISA;28/02/1998;2807;7211;0;317;999;2;UP;05;1;
11036;DIRECCION MUNICIPAL DE SERVICIOS COMUNALES DE AGUADA DE PASAJEROS;;MARTI NO. 92 E/ CROMBET Y CISNERO;31/01/1998;2701;9600;0;316;999;2;UP;05;2;00431
11037;DIRECCION MUNICIPAL DE SERVICIOS COMUNALES DE RODAS;;DELICIA NO. 15A ENTRE CALIXTO GARCÍA Y MÁXIMO GÓMEZ;31/01/1998;2702;9600;0;316;999;2;UP;05;2;00432
11038;DIRECCION MUNICIPAL DE SERVICIOS COMUNALES DE PALMIRA;;SAN PEDRO S/N E/ CERICE Y VILLUENDAS;31/01/1998;2703;9600;0;316;999;2;UP;05;2;00433
11039;DIRECCION MUNICIPAL DE SERVICIOS COMUNALES DE LAJAS;;MAXIMO GOMEZ FINAL;31/01/1998;2704;9600;0;316;999;2;UP;05;2;00434
11040;DIRECCION MUNICIPAL DE SERVICIOS COMUNALES DE CRUCES;;TERRAPLEN CARACAS S/N;31/01/1998;2705;9600;0;316;999;2;UP;05;2;00435
11041;DIRECCION MUNICIPAL DE SERVICIOS COMUNALES DE CUMANAYAGUA;;PASEO MARTI NO 53;31/01/1998;2706;9600;0;316;999;2;UP;05;2;00436
11042;DIRECCION MUNICIPAL DE SERVICIOS COMUNALES DE ABREUS;;MACEO NO 108 E/ AULET Y SERAFIN SANCHEZ;31/01/1998;2708;9600;0;316;999;2;UP;05;2;00438
11044;OFICINA DEL CONSERVADOR DE LA CIUDAD DE SANTIAGO DE CUBA;;HEREDIA E/ FELIX PENA Y CORONA .;31/12/1996;3406;9439;0;323;999;2;UP;07;1;
11045;EMPRESA CONSTRUCTORA Y DE MANTENIMIENTO DE REDES DE COMUNICACIONES;TELRED;CALLE ZANJA NO. 565 ENTRE OQUENDO Y MARQUES GONZALEZ;31/12/1996;2303;4520;0;161;698;1;EMP;02;0;14504
11055;HOSPITAL PSIQUIATRICO PROVINCIAL CLODOMIRA ACOSTA FERRALS;;CARLOS J, FINLAY S/N E/ CARRETERA CENTRAL Y 2 DE DICIEMBRE;31/03/1998;3105;9011;0;320;999;2;UP;05;1;
11056;DIRECCION MUNICIPAL DE SERVICIOS COMUNALES DE LA SIERPE;;CALLE 11 NO. 10 ENTRE AVENIDA 6 Y AVENIDA 8;31/03/1998;2808;9600;0;317;999;2;UP;05;2;00448
11062;EMPRESA DE RECUPERACION DE MATERIAS PRIMAS ARTEMISA;;CALLE 33, ENTRE 8 Y 10A;31/12/1996;2209;3399;1;102;670;1;EMP;02;0;05923
11065;DIRECCION MUNICIPAL DE LA VIVIENDA ISLA DE LA JUVENTUD;;CALLE 37 E/ 34 Y 36;31/03/1998;4001;7330;0;325;999;2;UP;05;2;00572
11069;EMPRESA AGROPECUARIA METROPOLITANA;;CARRETERA DE AEROCARIBBEAN, KM 1 1/2, WAJAY;31/03/1998;2313;0213;0;131;741;1;EMP;02;0;14536
11070;DIRECCION PROVINCIAL DE LA VIVIENDA DE HOLGUIN;;CALLE FOMENTO NO. 237 ENTRE ARIAS Y AGUILERA;31/03/1998;3206;7330;0;321;999;2;UP;05;1;
11071;EMPRESA CASA CONSULTORA DISAIC;DISAIC;BUENOS AIRE NO 100 ESQUINA LEONOR;31/03/1998;2310;7212;1;102;693;1;EMP;02;0;14387
11072;EMPRESA DE SEGURIDAD Y PROTECCION DEL MINSAP;;HEREDIA NO. 262, BAJOS, ENTRE SANTA CATALINA Y MILAGROS;31/03/1998;2309;7290;0;241;655;1;EMP;02;0;14204
11075;GRANJA ESTATAL PLANTAS MEDICINALES PINAR;;KM NO. 10 DE LA CARRETERA DE VINALES;30/04/1998;2108;0218;0;131;999;3;OEE;38;0;00131
11097;EMPRESA AGROPECUARIA CHAMBAS;;CALLE MARTI NO. 214 POBLADO DE CHAMBAS;31/12/1996;2901;0213;0;131;699;1;EMP;02;0;14508
11100;EMPRESA CONFECCIONES TEXTILES BOGA;;CALLE O'RREILLY NO. 358 ENTRE HABANA Y COMPOSTELA;31/01/1997;2304;2010;1;102;694;1;EMP;02;0;14388
11101;EMPRESA DE SEGURIDAD Y PROTECCION DEL MINAGRI;SEPMA;CONILL Y AVENIDA INDEPENDENCIA;31/05/1998;2302;7290;0;131;716;1;EMP;02;0;12758
11102;GRUPO EMPRESARIAL PALCO;GRUPO PALCO;CALLE 146 NO. 1104 ENTRE 11 Y 17D, RPTO. CUBANACAN;31/01/1997;2301;7290;0;654;654;1;GRUP;06;0;00302
11109;DIRECCION PROVINCIAL DE ECONOMIA Y PLANIFICACION CIENFUEGOS;;AVE. 52 NO. 2702 E/ 27 Y 29;31/01/1997;2707;7513;0;316;999;2;UP;05;1;
11110;DIRECCION PROVINCIAL DE FINANZAS Y PRECIOS CIENFUEGOS;;AVE 58 NO. 3513 E/ 35 Y 37;31/01/1997;2707;7513;0;316;999;2;UP;05;1;
11116;BANCO DE SANGRE DE CIENFUEGOS;;CALLE 51 Y AVE. 5 DE SEPTIEMBRE;28/02/1997;2707;9019;0;316;999;2;UP;05;1;00430
11117;DIRECCION PROVINCIAL DE LA VIVIENDA DE CIENFUEGOS;;AVE. 56 NO. 3702 E/ 37 Y 39;28/02/1997;2707;7330;0;316;999;2;UP;05;1;00430
11119;DIRECCION MUNICIPAL DE SALUD PUBLICA DE CAUTO CRISTO;;CARRETERA CENTRAL VIA LA YAYA;31/01/1997;3302;9012;0;322;999;2;UP;05;2;00532
11121;EMPRESA DE APROVECHAMIENTO HIDRAULICO DE HOLGUIN;;CARRETERA CENTRAL KM. 2 1/2 VIA BAYAMO;31/01/1997;3206;4230;1;113;907;1;EMP;02;0;12589
11124;DIRECCION MUNICIPAL DE SERVICIOS COMUNALES DE CESPEDES;;CALLE 17 NO 603,;31/05/1998;3001;9600;0;319;999;2;UP;05;2;00471
11125;DIRECCION MUNICIPAL DE SERVICIOS COMUNALES DE JIMAGUAYU;;EN POBLADO DEL MUNICIPIO JIMAGUAYU;31/05/1998;3011;9600;0;319;999;2;UP;05;2;00482
11126;DIRECCION MUNICIPAL DE SERVICIOS COMUNALES DE NAJASA;;EN POBLADO DEL MUNICIPIO NAJASA;31/05/1998;3012;9600;0;319;999;2;UP;05;2;00483
11128;EMPRESA AGROINDUSTRIAL DE GRANOS JOSE MANUEL CAPOTE SOSA;;CARRETERA DE TUNAS BAYAMO KM 26, JUCARITO;30/06/1998;3301;0211;0;131;741;1;EMP;02;0;14536
11129;EMPRESA NAVIERA FRIGORIFICA;FRIOMAR;CALLE OFICIOS NO. 170 E/ AMARGURA Y TENIENTE REY;28/02/1997;2304;6110;0;151;820;1;EMP;02;0;11234
11130;EMPRESA DE ACOPIO Y BENEFICIO DE TABACO SANCTI SPIRITUS;;CARRETERA DE ZAZA KM. 2;30/06/1998;2807;0215;0;131;881;1;EMP;02;0;12192
11132;DIRECCION MUNICIPAL DE SERVICIOS COMUNALES DE SIBANICU;;CARRETERA CENTRAL NO 254;31/05/1998;3007;9600;0;319;999;2;UP;05;2;00477
11133;DIRECCION MUNICIPAL DE SERVICIOS COMUNALES DE SIERRA DE CUBITAS;;MARIO HERRERO TOSCANO NO 24-A, SOLA.;31/05/1998;3003;9600;0;319;999;2;UP;05;2;00473
11134;ADMINISTRACIÓN MARÍTIMA DE CUBA;;CALLE FABRICA ENTRE ASPURU Y LINEA DE FERROCARRIL;31/01/1997;2304;6303;0;151;999;2;UP;05;0;00151
11137;EMPRESA RECINTO DE EXPOSICIONES DE HOLGUIN;EXPOHOLGUIN;AVE. DE LOS LIBERTADORES NO. 44;31/03/1997;3206;9432;0;321;999;1;EMP;02;1;00510
11141;EMPRESA AGROPECUARIA VINALES;;KM 1 1/2 DE LA CARRETERA DEL CEMENTERIO;30/06/1998;2104;0215;0;131;881;1;EMP;02;0;12192
11157;EMPRESA DE ACOPIO Y BENEFICIO DE TABACO MINAS;;KM 31 1/2 DE LA CARRETERA LUIS LAZO, SUMIDERO.;30/06/1998;2103;0215;0;131;881;1;EMP;02;0;12192
11161;DIRECCION MUNICIPAL DE DEPORTES LAS TUNAS;;SALA PACO CABRERA AVENIDA PRIMERO DE ENERO S/N E/ JULIAN GRIMAU Y WALTER MULET;30/06/1998;3105;9510;0;320;999;2;UP;05;2;00495
11163;EMPRESA PRODUCTORA DE ALIMENTOS DE REGLA;PRODAL;CALLE 27 DE NOVIEMBRE NO. 9 ENTRE BENITO ANIDO Y LITORAL;31/01/1997;2305;1512;1;111;624;1;EMP;02;0;14097
11174;EMPRESA AGROFORESTAL SAGUA DE TANAMO;;FELIPE ROMERO NO.108;30/06/1998;3213;0214;0;131;879;1;EMP;02;0;12189
11175;EMPRESA AGROFORESTAL BARTOLOME MASO MARQUEZ;;AVENIDA MASO, RIO YARA;30/06/1998;3311;0214;0;131;879;1;EMP;02;0;12189
11176;EMPRESA AGROFORESTAL ATAQUE A BUEYCITO;;CORONEL LIENS NO. 213;30/06/1998;3312;0214;0;131;879;1;EMP;02;0;12189
11177;EMPRESA AGROFORESTAL BATALLA DE GUISA;;VICTOR RAMOS NO. 46 E/ PAQUITO GONZALEZ Y VAN TROI;30/06/1998;3313;0214;0;131;879;1;EMP;02;0;12189
11180;EMPRESA AGROFORESTAL TERCER FRENTE;;REPARTO SAN RAFAEL S/N;30/06/1998;3408;0214;0;131;879;1;EMP;02;0;12189
11186;EMPRESA CUBANA MINERA DEL ESTE;EME;NICARO;28/02/1997;3211;1210;0;104;618;1;EMP;02;0;60258
11187;DIRECCION MUNICIPAL DE PLANIFICACION FISICA ISLA DE LA JUVENTUD;;CALLE NO. 41 NO. 3004 E/ 30 Y 32, NUEVA GERONA;30/06/1998;4001;7513;0;325;999;2;UP;05;2;00572
11188;DIRECCION MUNICIPAL DE FINANZAS Y PRECIOS ISLA DE LA JUVENTUD;;CALLE NO 39 ESQUINA A CALLE 38, NUEVA GERONA;30/06/1998;4001;7513;0;325;999;2;UP;05;2;00572
11189;DIRECCION MUNICIPAL DE ECONOMIA Y PLANIFICACION ISLA DE LA JUVENTUD;;CALLE NO 39 ESQUINA A CALLE 38, NUEVA GERONA;30/06/1998;4001;7513;0;325;999;2;UP;05;2;00572
11190;DIRECCION MUNICIPAL DE TRABAJO ISLA DE LA JUVENTUD;;CALLE NO 28 E/ 35 Y 37, NUEVA GERONA;30/06/1998;4001;9132;0;325;999;2;UP;05;2;00572
11191;DIRECCION MUNICIPAL DE COMERCIO ISLA DE LA JUVENTUD;;CALLE 22 NO. 3712 E/ CALLES 37 Y 39 EN NUEVA GERONA;30/06/1998;4001;7513;0;325;999;2;UP;05;2;00572
11195;EMPRESA DE ASEGURAMIENTO Y SERVICIOS AL GRUPO AGRICOLA;;AVENIDA. INDEPENDENCIA NO. 12555 ESQUINA A CAPDEVILA;30/06/1998;2313;3421;0;131;741;1;EMP;02;0;14536
11196;EMPRESA DE SUMINISTROS AGROPECUARIOS HABANA;;CARRETERA DE LUCERO, KM 2 1/2, REPARTO MANTILLA;30/06/1998;2314;5150;0;131;716;1;EMP;02;0;12758
11205;ADUANA DEL PUERTO DE LA HABANA;;SAN PEDRO NO. 1;30/04/1997;2304;7511;0;304;999;2;UP;05;0;00304
11206;EMPRESA AGROFORESTAL SONGO LA MAYA;;PEREZ CARBO NO. 6, LA MAYA;30/06/1998;3405;0214;0;131;879;1;EMP;02;0;12189
11210;CENTRO DE DESARROLLO ARTESANAL QUITRIN;;CALLE OBISPO NO. 163 ESQUINA A SAN IGNACIO;31/03/1997;2304;2010;0;505;999;1;EMP;02;0;
11211;EMPRESA AGROFORESTAL MAISI;;LA MAQUINA;30/06/1998;3505;0214;0;131;879;1;EMP;02;0;12189
11212;EMPRESA AGROFORESTAL YATERAS;;PALENQUE DE YATERAS;30/06/1998;3503;0214;0;131;879;1;EMP;02;0;12189
11214;EMPRESA AGROFORESTAL EL SALVADOR;;LIMONCITO DE BAYATE;30/06/1998;3501;0214;0;131;879;1;EMP;02;0;12189
11216;EMPRESA AGROPECUARIA SAN ANTONIO DEL SUR;;PURIALES DE CAUJERI;30/06/1998;3507;0214;0;131;741;1;EMP;02;0;14536
11218;EMPRESA NAVIERA POSEIDON;;CALLE OFICIOS NO. 170, E/ LAS CALLES AMARGURA Y TTE. REY;28/02/1997;2304;6110;0;151;820;1;EMP;02;0;11234
11226;EMPRESA MAYORISTA DEL MERCADO PARALELO;EMMP;MURALLA NO. 462 E/ CRISTO Y VILLEGAS;30/04/1997;2304;5190;0;171;902;1;EMP;02;0;13309
11229;EMPRESA PROVINCIAL DE CONFECCIONES TEXTILES, UNYMODA;;CALLE DOS DE MAYO NO. 8507 A E/ MEDIO Y RIO;30/06/1998;2501;2010;1;314;707;1;EMP;02;1;12677
11237;PALACIO DE TEATRO LA COLMENITA;;CALLE NO. 13 NO. 404 ALTOS E/ G Y F VEDADO;31/07/1998;2302;9439;0;502;999;4;OEE;03;0;00502
11238;EMPRESA PRODUCTORA DE IMPRESOS DE SEGURIDAD Y ACUÑACIONES;IMPRESOS DE SEGURIDAD;CALLE GIRAL NO. 77 ENTRE BERNAL Y PORTOCARRERO;31/03/1997;2314;2421;1;272;999;1;EMP;02;0;00272
11240;EMPRESA DE ACUEDUCTO Y ALCANTARILLADO DEL OESTE DE CIUDAD DE LA HABANA AGUAS DEL OESTE DE LA HABANA;;CALLE 5 PALMAS, NÚMERO 11542, ENTRE ARROYO PAILA Y CARRETERA VARONA, CAPDEVILA;30/04/1997;2313;4230;0;113;899;1;EMP;02;0;12590
11293;EMPRESA DE SEGURIDAD Y PROTECCION DEL MINISTERIO DE EDUCACION SUPERIOR;ESPMES;CALLE I NO. 166 ENTRE CALLE 9 Y CALLE 11, VEDADO;30/09/1998;2302;7290;0;223;731;1;EMP;02;0;12891
11307;EMPRESA COMERCIAL DE ALIMENTOS, COPMAR;;CALLE HACENDADOS, NO. 7, AVENIDA LA PESQUERA Y LINEA DEL FERROCARRIL;31/03/1997;2304;5190;1;111;624;1;EMP;02;0;14097
11328;EMPRESA AGROPECUARIA LA PALMA;;EL BATEY JIBARA, CARRETERA PINAR DEL RIO A LA PALMA;31/07/1998;2105;0215;0;131;881;1;EMP;02;0;12192
11352;ESCUELA DE SUPERACION DE PERFECCIONAMIENTO ATLETICO DE LAS TUNAS;E.S.P.A.TUNAS;AVE 2 DE DICIEMBRE S/N REPARTO AURORA;28/02/1997;3105;8521;0;320;999;2;UP;05;1;
11353;EMPRESA MUNICIPAL DE GASTRONOMIA PUERTO PADRE;;RUBI NO. 28;28/02/1997;3102;5610;0;320;659;1;EMP;02;2;14255
11357;EMPRESA DE TABACO TORCIDO SANCTI SPIRITUS;;BEREMUNDO PAZ, NO. 92, E/ HECTOR CASTELLANOS Y AVE. CAMILO CIENFUEGOS;30/04/1997;2804;1800;1;131;881;1;EMP;02;0;12192
11374;EMPRESA CONSTRUCTORA PUERTO CARENA;;MERCADERES NO. 263 ENTRE AMARGURA Y TENIENTE REY;31/05/1997;2304;4520;0;700;700;1;EMP;02;0;14511
11390;EMPRESA DE CONSERVACION DE TUNELES;;KM 0, CARRETERA MONUMENTAL;30/06/1997;2306;4520;0;151;605;1;EMP;02;0;00605
11407;GRUPO DE LA INDUSTRIA ELECTRONICA, LA INFORMATICA, LA AUTOMATIZACION Y LAS COMUNICACIONES;GELECT;CALLE 34 NO. 118 E/ 1RA Y 3RA, MIRAMAR;31/07/1997;2301;7214;0;102;839;1;GRUP;06;0;00102
11408;EMPRESA DE ANTENAS;;CARRETERA CENTRAL NO. 536, FRANCISCO PEREZ;31/07/1997;2609;3630;3;102;839;1;EMP;02;0;11407
11479;EMPRESA DE ASEGURAMIENTO LOGISTICO;SUMIFER;CALZADA DE MANAGUA, S/N ENTRE 3RA Y 5TA, RPTO. PARCELACION MODERNA;31/01/1997;2314;5141;1;151;629;1;EMP;02;0;04600
11487;EMPRESA PROVINCIAL DE TALLERES Y SERVICIOS PINAR DEL RIO;;GERARDO MEDINA NO. 310;31/01/1997;2108;5040;1;311;906;1;EMP;02;1;13854
11525;EMPRESA MUNICIPAL DE COMERCIO Y GASTRONOMIA CARDENAS;;CESPEDES E/ CORONEL VERDUGO E INDUSTRIA;30/04/1997;2502;5335;0;314;666;1;EMP;02;2;14281
11526;EMPRESA MUNICIPAL DE COMERCIO Y GASTRONOMIA COLON;;MARIO MUNOZ NO. 87 ESQUINA MAXIMO GOMEZ;30/04/1997;2504;5335;0;314;666;1;EMP;02;2;14281
11527;EMPRESA MUNICIPAL DE COMERCIO Y GASTRONOMIA JOVELLANOS;;CALLE 11 NO. 1611 E/ 16 Y 18;30/04/1997;2506;5335;0;314;666;1;EMP;02;2;14281
11528;EMPRESA MUNICIPAL DE COMERCIO Y GASTRONOMIA JAGUEY GRANDE;;CALLE 13 E/ 52 Y 54;30/04/1997;2511;5335;0;314;666;1;EMP;02;2;14281
11529;EMPRESA MUNICIPAL DE COMERCIO Y GASTRONOMIA MARTI;;MACEO NO. 307 E/ RAUL PUPO MORALES Y ESTEBAN HERNANDEZ;30/04/1997;2503;5335;0;314;666;1;EMP;02;2;14281
11530;EMPRESA MUNICIPAL DE COMERCIO Y GASTRONOMIA PERICO;;DANIEL NO. 90 E/ ALVAREZ Y LINEA;30/04/1997;2505;5335;0;314;666;1;EMP;02;2;14281
11531;EMPRESA MUNICIPAL DE COMERCIO Y GASTRONOMIA PEDRO BETANCOURT;;CALLE 24 NO. 1901 E/ 19 Y 21;30/04/1997;2507;5610;0;314;666;1;EMP;02;2;14281
11532;EMPRESA MUNICIPAL DE COMERCIO Y GASTRONOMIA UNION DE REYES;;MACEO NO. 66 E/ JOSE MARTI Y FINAL;30/04/1997;2509;5610;0;314;666;1;EMP;02;2;14281
11533;EMPRESA MUNICIPAL DE COMERCIO Y GASTRONOMIA LIMONAR;;MAXIMO GOMEZ NO. 75 E/ NELSON FERNANDEZ Y BRIGADIER ROJAS;30/04/1997;2508;5335;0;314;666;1;EMP;02;2;14281
11534;EMPRESA MUNICIPAL DE COMERCIO Y GASTRONOMIA LOS ARABOS;;JUAN BRUNO ZAYAS NO. 3 E/ MARTI Y CLEMENTE ZENEA;30/04/1997;2513;5610;0;314;666;1;EMP;02;2;14281
11535;EMPRESA MUNICIPAL DE COMERCIO Y GASTRONOMIA CALIMETE;;INDEPENDENCIA NO. 79 E/ SAN JUAN Y MASSUET;30/04/1997;2512;5335;0;314;666;1;EMP;02;2;14281
11537;EMPRESA MUNICIPAL DE SERVICIOS GASTRONOMICOS DE MATANZAS;;INDEPENDENCIA NO. 29803 E/ DOS DE MAYO Y AMERICA;30/04/1997;2501;5610;0;314;666;1;EMP;02;2;14281
11567;EMPRESA AGROFORESTAL MINAS;;REPARTO VIETNAM HEROICO, FINAL;30/06/1997;2103;0500;1;131;879;1;EMP;02;0;12189
11572;EMPRESA AGROFORESTAL LA PALMA;;LA JIBARA;30/06/1997;2105;0500;1;131;879;1;EMP;02;0;12189
11573;EMPRESA AGROFORESTAL GUAMA;;EL MARANON, S/N, CHIVIRICO;30/06/1997;3409;0500;1;131;879;1;EMP;02;0;12189
11576;EMPRESA AGROFORESTAL SIERRA CRISTAL SEGUNDO FRENTE;;CALLE CONGRESO EN ARMAS, NO. 96, RPTO. CANA AMARILLA;30/06/1997;3404;0500;1;131;879;1;EMP;02;0;12189
11578;EMPRESA AGROFORESTAL GUANTANAMO;;CARRETERA BAYATE KILOMETRO 3 1/2, MONTESANO;30/06/1997;3509;0500;1;131;879;1;EMP;02;0;12189
11581;EMPRESA AGROFORESTAL IMIAS;;CALLE 5 A, NO. 295, REPARTO JESÚS LORES;30/06/1997;3506;0500;1;131;879;1;EMP;02;0;12189
11582;GRANJA ESTATAL LA CAOBA;;CARRETERA A LA PALMA, ENTRONQUE DE SAN ANDRES;30/06/1997;2105;0213;0;131;879;3;OEE;03;0;12189
11583;GRANJA ESTATAL LA LOMA;;CARRETERA A LA PALMA, ENTRONQUE DE SAN ANDRES;30/06/1997;2105;0213;0;131;879;3;OEE;03;0;12189
11584;EMPRESA DE FERIAS AGROPECUARIAS;;AVENIDA INDEPENDENCIA, NO. 31108, RANCHO BOYEROS;30/06/1997;2313;9439;0;131;699;1;EMP;02;0;14508
11592;EMPRESA DE SERVICIOS A TRABAJADORES DE HOLGUIN;;CALLE ARIAS NO. 178, ENTRE NARCISO LÓPEZ Y MORALES LEMUS;31/07/1998;3206;5610;1;126;828;1;EMP;02;0;11994
11601;EMPRESA DE CONSTRUCCIÓN Y MONTAJE DE OBRAS DEL TURISMO DE VARADERO;;CALLE 12 ENTRE VIA RAPIDA CARDENAS, VARADERO Y FINAL, SANTA MARTHA CARDENAS MATANZAS;31/07/1998;2502;4520;1;126;828;1;EMP;02;0;11994
11603;EMPRESA CONSTRUCTORA DE OBRAS DE ARQUITECTURA NO. 37;;CALLE SAN JOSE FINAL, ZONA INDUSTRIAL NO. 2, PUEBLO GRIFO;31/07/1998;2707;4520;1;126;828;1;EMP;02;0;11994
11608;EMPRESA REGISTRO CUBANO DE BUQUES;RCB SOCIEDAD CLASIFICADORA;CALLE 5TA AVENIDA NO. 1202 E/ 12 Y 14 MIRAMAR;31/07/1997;2301;7513;1;151;855;1;EMP;02;0;11769
11609;EMPRESA DE SERVICIOS A TRABAJADORES DE CIENFUEGOS;;AVENIDA 60 NO. 4302, ENTRE 43 Y 45;31/07/1998;2707;5610;1;126;828;1;EMP;02;0;11994
11620;EMPRESA PROCESADORA DE CAFE LUIS BOUCOURT;;CARRETERA PUNTA DE PIEDRA KM. 2 1/2;30/06/1997;2201;1544;1;131;879;1;EMP;02;0;12189
11622;EMPRESA PROCESADORA DE CAFE ELADIO MACHIN;;NAPOLEON DIEGO, NO. 265;30/06/1997;2706;1544;1;131;879;1;EMP;02;0;12189
11623;EMPRESA PROCESADORA DE CAFE ROLANDO AYUB;;CALLE 36 NO. 18 ENTRE CALLE 25 Y CALLE 31, REPARTO CABRERA;30/06/1997;3401;1544;1;131;879;1;EMP;02;0;12189
11626;EMPRESA PROCESADORA DE CAFE ASDRUBAL LOPEZ;;CALLE 17 SUR, ENTRE REGINO ELADIO BOTTI Y 13 DE JUNIO;30/06/1997;3509;1544;1;131;879;1;EMP;02;0;12189
11635;CENTRO PROVINCIAL PARA LA ENSENANZA ARTISTICA;CPEA;CIRCUNVALACION Y LINEA BANDA;30/09/1997;2609;8521;0;315;999;2;UP;05;1;
11657;DIRECCION MUNICIPAL DE SERVICIOS COMUNALES DE MARTI;;CALLE MACEO NO. 243 (INTERIOR) E/ JOSE SMITH COMAS Y CAMILO CIENFUEGOS;30/09/1997;2503;9600;0;314;999;2;UP;07;2;00384
11658;DIRECCION MUNICIPAL DE SERVICIOS COMUNALES DE PERICO;;CALLE JULIAN DOMINGUEZ NO. 6 E/ SOTOLONGO Y ALZUGARAY;30/09/1997;2505;9600;0;314;999;2;UP;07;2;00386
11659;DIRECCION MUNICIPAL DE SERVICIOS COMUNALES DE CALIMETE;;MODESTO RODRIGUEZ NO. 2 E/ SANTA ANA Y FINAL, MANGUITO;30/09/1997;2512;9600;0;314;999;2;UP;07;2;00394
11660;DIRECCION MUNICIPAL DE SERVICIOS COMUNALES DE LIMONAR;;BRIGADIER ROJAS NO. 32 E/ BIENVENIDO SANCHEZ Y ANTONIO MACEO;30/09/1997;2508;9600;0;314;999;2;UP;07;2;00389
11661;DIRECCION MUNICIPAL DE SERVICIOS COMUNALES DE LOS ARABOS;;CARLOS MANUEL DE CESPEDES NO. 2 E/ 9A Y PASAJE;30/09/1997;2513;9600;0;314;999;2;UP;07;2;00395
11669;DIRECCION MUNICIPAL DE SERVICIOS COMUNALES DE PEDRO BETANCOURT;;CALLE 24 NO. 2105 ENTRE 21 Y 23;30/09/1997;2507;9600;0;314;999;2;UP;07;2;00388
11670;DIRECCION MUNICIPAL DE SERVICIOS COMUNALES DE CIENAGA DE ZAPATA;;CARRETERA PLAYA LARGA. PALPITE;30/09/1997;2510;9600;0;314;999;2;UP;07;2;00392
11677;EMPRESA DE TRANSPORTE AGROPECUARIO;;AVENIDA INDEPENDENCIA, KM 1 1/2, ESQUINA A CAPDEVILLA;30/09/1998;2313;6023;1;131;716;1;EMP;02;0;12758
11678;EMPRESA PRODUCTORA DE PIENSOS ORIENTE;;CALLE AGUILERA NO. 168 ALTOS E/ CORONA Y PADRE RICO;30/09/1998;3406;1533;0;131;699;1;EMP;02;0;14508
11680;EMPRESA DE SEGURIDAD Y PROTECCION DEL SIME;DELTHA-SEGURIDAD;CALLE COLON NO. 47 ENTRE ACACIA E INDEPENDENCIA, REPARTO MARTI;30/09/1998;2310;7290;0;102;693;1;EMP;02;0;14387
11682;EMPRESA DE SEGURIDAD Y PROTECCION DEL MINISTERIO DE LA CONSTRUCCION, ESPCONS;;CALLE AYUNTAMIENTO NO. 80 ENTRE CONILL Y TULIPAN;30/09/1998;2302;7290;0;126;828;1;EMP;02;0;11994
11683;EMPRESA PROVINCIAL COMERCIALIZADORA DE LA MUSICA Y LOS ESPECTACULOS BENNY MORE;;CALLE 19 ESQ. N EDIFICIO FOCSA, VEDADO;30/09/1997;2302;9439;0;313;999;1;EMP;02;1;00360
11684;EMPRESA PROVINCIAL COMERCIALIZADORA DE LA MUSICA Y LOS ESPECTACULOS ADOLFO GUZMAN;;7MA NO. 1608 E/ 16 Y 18, MIRAMAR;30/09/1997;2301;9414;0;313;999;1;EMP;02;1;00360
11685;EMPRESA PROVINCIAL COMERCIALIZADORA DE LA MUSICA Y LOS ESPECTACULOS IGNACIO PINEIRO;;CALLE SAN RAFAEL NO. 1215 ENTRE RONDA Y MAZON, VEDADO;30/09/1997;2302;9439;0;313;999;1;EMP;02;1;
11686;TEATRO DE VARIEDADES AMERICA;;GALIANO NO. 253 E/ NEPTUNO Y CONCORDIA;30/09/1997;2303;9439;0;313;999;4;OEE;03;1;
